Questions,Answer
What causes the stomach flu (gastroenteritis)?,"'Bacteria and ''viruses'' -- infectious agents -- (the most common cause) are the most frequent causes of gastroenteritis in the U.S. and worldwide. Infections cause diarrhea and other symptoms by causing inflammation of the gastrointestinal (GI) tissue. The infections increase the fluid content in the ''intestines'"" and colon by changing the gastrointestinal tract's ability to absorb water and by increasing the speed of transit (motility) for things you ingest. This, in turn, causes diarrhea. Infectious agents may physically damage intestinal cells directly or indirectly with secreted toxins."" "
What are the most common causes of the stomach flu (gastroenteritis)?,"'The most prevalent cause of gastroenteritis in the U.S. and the world is '' Norovirus''. It causes about 50%-70% of viral gastroenteritis cases, while '' Rotavirus, Astrovirus, ''Adenovirus'', and ''Sapovirus'' ''strains'' cause most of the other viral gastroenteritis infections. ''Norovirus'' also was listed as the leading cause of gastroenteritis in children under 5 years old according to the Centers for Disease Control and ''Prevention'' (CDC).''Bacterial causes of gastroenteritis that occur worldwide are ''Salmonella, Shigella, Campylobacter Aeromonas'', and '' ''Escherichia coli'' (''E. coli'') ''strains of bacteria. Other bacteria like ''Clostridium, ''Vibrio'', Campylobacter'', and ''Yersinia spp'' can cause outbreaks occasionally. Occasionally, some bacterial causes of gastroenteritis (for example, ''Salmonella'' and , certain ''E. coli'' strains) may produce hemorrhagic or bloody diarrhea.''Parasites such as ''Giardia'', Cryptosporidium'', and ''Entamoeba'' infections can cause gastroenteritis and occasionally, other parasites have outbreaks such as the ''Cyclospora'' outbreak that occurred in 2012 to 2013 in the U.S.''There are many other less frequent causes of gastroenteritis such as food ''allergies'' (eosinophilic gastroenteritis), antibiotics, and toxins. Gastroenteritis symptoms are frequently listed as possible side effects of many medicines.''In most instances, food and ''drinks'' come into contact with feces contaminated with the infecting agent. This can happen in the fields, or in transport, storage, and processing of food and drinks. In processed foods and drinks, this contamination is relatively rare, but when it occurs, an outbreak of the disease is often traced back to faulty equipment, human errors in the processing and/or a breakdown of quality-control procedures.'  "
Is the stomach flu (gastroenteritis) contagious?," The large majority of causes (viral and bacterial) of gastroenteritis are contagious, usually through food or water contamination. In addition, they can be transferred person to person. Exposures to body fluids (for example, feces or droplets containing infectious agents) are common sources that transmit the disease to others (See transmission section). A few causes of gastroenteritis are not contagious, for example, food allergies or the side effects of medications."
Who gets the stomach flu (gastroenteritis)?,"'Gastroenteritis (stomach flu) is a common, worldwide disease and almost everyone suffers from it a few times in their life because it is almost impossible to avoid contact with some of the viral and bacterial causes.' People living in crowded conditions (military, cruise ships, dorms) are at higher risk, as are people living in developing countries who often have a diet that contains contaminated food or water. Infants, children, and some adults (elderly, immunosuppressed) are at higher risk because of immature or depressed immune systems and also because they can become dehydrated faster than older children and adults. Some people taking antibiotics are at higher risk because the antibiotics depress the normal GI microbes and allow bacteria or viruses like Clostridium difficile to predominate and cause disease. People who do not practice good hygiene and hand washing techniques are at higher risk, as are those who eat under cooked and/or unwashed foods or drink from potentially contaminated fluid sources (rivers, streams, unpasteurized milk, for example)."
When should you call a doctor for the stomach flu (gastroenteritis)?,"'If gastroenteritis symptoms last more than about five days, increase in severity (fever of 101 F or 38.33 C or higher), or a person develops bloody diarrhea, dehydration, constant ''abdominal pain'' or other symptoms see a physician. The patient may have some gastroenteritis symptoms but may have a disease more serious than self-limiting gastroenteritis. Signs and ''symptoms of dehydration'' may include decreased or no urine production, dry ''mucus'' membranes, ''dry mouth'' or skin, no tears, ''weakness'', ''lightheadedness'' and ''low blood pressure'', while children may show little or no urination, become lethargic, have skin that ""tents up"" when pinched. Signs of dehydration in anyone are good reasons to see a doctor immediately.' "
How do you know that you have the stomach flu (gastroenteritis)?,"'There are no specific tests for gastroenteritis, thus gastroenteritis is most often diagnosed by the symptoms it produces, mainly diarrhea. Because gastroenteritis is usually a self-limited disease, the large majority of people are never seen or diagnosed by a doctor. However, during outbreaks like those seen on cruise ships, viral and bacterial cultures or ''PCR'' and other immunologically based tests can eventually identify the causative pathogen. By the time this identification occurs, most of the individuals with gastroenteritis have begun to recover.''When gastroenteritis symptoms become severe, most public health officials and health care professionals run such tests to identify the causative agent of a specific disease, based on all of the history of the patients, physical exams, and symptoms. In addition, patients with similar histories of recent food or drink they had in common with others often helps to discover the source of the disease (for example, people who got diarrhea had salads from the same food source).' 

Read Doctor's View
  "
Are the stomach flu (gastroenteritis) and food poisoning the same condition?,"'Although the stomach flu and ''food poisoning'' share some common symptoms such as diarrhea, nausea and vomiting, ''stomach cramps'', muscle aches, for example, they are not exactly the same condition.''Consequently, there is some crossover between the two terms.''In addition:' Stomach flu or gastroenteritis means any nonspecific inflammatory problem in the gastrointestinal tract; some doctors consider the stomach flu to be more narrowly defined as a viral infection that attacks the digestive system. Food poisoning specifically is caused by eating or drinking contaminated food or fluid that contains bacteria, viruses, parasites and/or their toxins they produce. Food poisoning usually is found in small outbreaks that occur among individuals that have ingested the same foods or drink, and symptoms occur rapidly within hours; whereas the stomach flu has a more gradual onset of symptoms and usually lasts longer than food poisoning. Stomach flu is highly contagious and can be spread quickly to other individuals; whereas food poisoning usually requires ingesting the poison and does not easily spread to other individuals."
Are the stomach flu (gastroenteritis) and the flu (influenza) the same infection?,"'Although both the stomach flu and the flu (influenza) may be caused by viruses, the viral genus and species are different for each entity.' The viruses that cause the majority of stomach flu (gastroenteritis) are Norovirus spp; whereas the viruses that cause influenza are mainly Influenza A and B viral spp and subtypes. Stomach flu results mainly in problems with the gastrointestinal tract while influenza (flu) involves the respiratory tract. These two problems are not the same thing."
What foods are recommended to eat (diet ) when you have the stomach flu (gastroenteritis)?,"'Some health care professionals suggest a special diet for the gastroenteritis, especially for viral and/or bacterial infections in children. First and foremost is adequate fluid rehydration to prevent dehydration.''The diet frequently suggested is termed the ""BRAT"" diet. This diet consists of foods that are not usually irritating but soothing for the gastrointestinal tract. The ''BRAT diet'"" stands for bananas, rice, applesauce and toast. Although some doctors think this diet may not markedly benefit patients, others recommend it for both adults and children for a day or two to make the transition from the resolving symptoms of acute gastroenteritis to the patient's previously normal diet."" "
"What natural and home remedies help soothe stomach flu (gastroenteritis) 
symptoms?"," Home treatment consists of adequate fluid intake so dehydration is prevented Clear fluids are recommended (Pedialyte especially for young children, Gatorade, PowerAde and other sports drinks), but not fruit juices or milk as they may prolong the symptoms Salt Ginger Baking soda Apple cider vinegar Basil Chamomile tea Asafetida spice Zinc Cinnamon Mint Turmeric Yogurt"
What is the treatment for the stomach flu (gastroenteritis)?,"'Most people with the stomach flu require no formal treatment. The key to a rapid and safe recovery at home (home remedy) is proper hydration. If dehydration occurs, the patient should be evaluated by a doctor. Many health care professionals choose to begin IV fluids, the treatment of choice for rapid rehydration.''Other medications may be prescribed to reduce the symptoms of gastroenteritis. To reduce vomiting, ''promethazine'' (Phenergan), ''prochlorperazine'' (''Compazine''), or ''ondansetron'' (''Zofran'') are often used. Some physicians suggest using these agents only as a suppository or rapidly disintegrating tablet on the tongue since patients may vomit the pills up. Others may prescribe ''diphenoxylate and atropine'' (''Lomotil'') or lopermadine (''Imodium'') to slow diarrhea while others do not as the drugs may prolong the disease in some individuals. Many doctors recommend no medical treatment for gastroenteritis symptoms as all of the drugs have side effects and if the patient stays well hydrated, the symptoms usually stop soon anyway.'""As the gastroenteritis symptoms abate, especially vomiting, doctors may recommend a BRAT diet (bananas, rice, apples and toast) for a day or two before returning to the patient's regular diet. Potatoes, lean meat like chicken and whole grains can help replace nutrients and ""'electrolytes'' lost with diarrhea.''Patients who have more serious symptoms or other symptoms in addition to gastroenteritis need to be evaluated, diagnosed, and treated by a physician because the patient will likely have a specific disease that will need treatment. The treatment will depend on the cause of the illness (for example, salmonellosis or ''Clostridium difficile'' toxin). Antibiotics and other treatments may not be recommended for some of these diseases so an accurate diagnosis of the disease is important. For ''Clostridium difficile'' infected patients, antibiotic sensitivity testing may need to be done to determine the most effective antibiotics to use.' 

Read Doctor's View
  "
How long does the stomach flu (gastroenteritis) last?,"'Depending upon the cause of gastroenteritis, it may be considered acute or chronic.' Acute gastroenteritis (viral) lasts about seven to 14 days, and is then usually self-cured. Chronic gastroenteritis (for example, allergic gastroenteritis) may last for months or longer if not diagnosed and appropriately treated."
What are complications of the stomach flu (gastroenteritis)?,"'Most patients who get gastroenteritis have no complications and will completely recover. The major complication for some patients is dehydration; infants, children, the elderly and immunosuppressed are at higher risk for this complication. In many third world countries, hydration of infants is difficult at best so there are many infant deaths worldwide due to dehydration caused by gastroenteritis.'  "
What is the prognosis for the stomach flu (gastroenteritis)?,"'The prognosis (outlook) for complete recovery is excellent in most people infected with viral and bacterial caused gastroenteritis, as long as the person keeps well hydrated. Because infants, children, ''pregnant'' women, and adults that are elderly or immunosuppressed, usually dehydrate faster than healthy adults and sometimes are more difficult to rehydrate orally, their prognosis can range from excellent to poor. Their prognosis depends on how dehydrated they become and how effective are the attempts to rehydrate the patient.''The prognosis for those patients that develop gastroenteritis symptoms as part of a specific disease process (for example, ''shigellosis'') vary from good to poor, depending on the severity of the specific disease process.' "
Can you prevent from getting the stomach flu (gastroenteritis)?,"'There is no diet that will prevent gastroenteritis but food preparation plays a strong role in preventing gastroenteritis. In general, there are some actions people can do to prevent or reduce the chance of getting gastroenteritis, including:''There is a vaccine available against rotavirus that has reduced this infection in children. Also, there is a vaccine available against cholera-causing bacteria (''Vibrio''), but it is not widely available. A clinical trial of a Norovirus vaccine was done with some success. It is likely in the near future commercial ''vaccines'' against some causes will be available.' Hand washing, especially before eating and after any close association with an infected person or items (clothing, bedding, toys) they have touched Launder items daily that infected persons wear Avoid direct contact with infected individuals when possible Do not eat undercooked foods, especially meats Do not eat raw foods or drink untreated water Do not drink untreated or unpasteurized fluids, especially milk Thoroughly wash any produce, especially in third world countries, before eating While traveling, avoid all raw foods and ice; drink only from sealed bottled products and use bottled water for tooth brushing"
Which specialties of doctors treat the stomach flu (gastroenteritis)?,"""Most individuals with viral or mild bacterial caused gastroenteritis require no treatment or can be treated by the patient's primary care provider or pediatrician. For more patients with more severe gastroenteritis, such infectious disease specialists, gastroenterologists, ""'emergency medicine'' specialists, allergists, critical care physicians, and hematologists may be consulted.' "
What is the stomach flu (gastroenteritis)?,"'Stomach flu'' or ''gastroenteritis'' is a general term for a number of inflammatory problems that occur in the gastrointestinal tract. ''Gastroenteritis'' is a better term because when some individuals use the term ""stomach ''flu'',"" they get the term confused with the ''flu'' (''influenza'') and the ''viruses'' that cause the flu. ''Influenza'' ''viruses'' do not cause ''stomach flu''.''The most common symptoms of the stomach flu include:''Other symptoms may include:''Because stomach flu means gastroenteritis and, because when the term “stomach flu” is used, the readers usually mean acute gastroenteritis caused by viruses (mainly ''Norovirus''); the emphasis of this article will be on ''Norovirus''- caused gastroenteritis although other causes will be mentioned.'   Diarrhea Nausea Vomiting Abdominal pain Fever Headache Body aches Dehydration"
Is the stomach flu contagious? What causes it?,"'There are many causes of stomach flu. The most common causes are ''contagious'' gastroenteritis, and include:''However, many other causes of gastroenteritis that are not ''contagious'' include:''Many medications list gastroenteritis as a common side effect.' Viruses (for example, Norovirus, Adenovirus and others), Bacteria (for example,  Salmonella,  Shigella,  E. coli and others), and Parasites (for example  Giardia lamblia, Cryptosporidium, and others). Food allergies Antibiotics Toxins"
What are the signs and symptoms of the stomach flu?,"'The primary symptom of stomach flu or gastroenteritis is ''diarrhea'' that does not contain blood usually accompanied by ''nausea'', some occasional ''vomiting'', and abdominal cramping.''The incubation time for gastroenteritis varies according to the particular cause. The most rapid incubation time is usually with viral illnesses (for example, for ''Norovirus'', which is about 1 -2 days), and the infected person may become contagious during this time without symptoms of ''nausea'' or ''diarrhea''.''Noncontagious causes (''allergies'', toxins, medication side effects) may produce symptoms very rapidly (minutes to hours) and in some people, the symptoms may become so severe that they require emergency care.'""Doctors usually base the diagnosis on the person's history and physical exam; some patients will need further blood and fecal tests done to determine the cause, especially in more severe infections.""  "
How is the stomach flu spread (how do you get it)?,"   Contagious causes of stomach flu (gastroenteritis) are spread usually through contamination of food or water or by person-to-person (fecal – oral route) spread via contaminated droplets containing infectious organisms. Some of the contagious causes of gastroenteritis (most notably, Norovirus) can be spread by kissing and other close personal contact or on surfaces where droplets containing viruses or other agents survive. Some viruses can even be spread to household pets such as dogs that, in turn, can spread the disease to other people. Fortunately, most causes of contagious gastroenteritis are not spread by breastfeeding or through breast milk. Noncontagious gastroenteritis such as that related to side effects of medicine or food allergies is not spread from person to person."
How long is the stomach flu contagious (incubation period)?,"'Stomach flu is contagious when the organisms that cause stomach flu are spread to uninfected individuals. The timeframe or how long the infected person remains contagious depends on the infecting cause. For example, most common cause of stomach flu is ''Norovirus''. It has an incubation period of about 12 - 48 hours, and can cause the person to be contagious during the incubation period and for as long as they shed virus (usually about three days after symptoms stop but sometimes up to two weeks). ''Norovirus'' symptoms usually last about one to two days and is sometimes termed the 24 hour stomach flu.''Other infectious agents such as other viral ''strains'', bacteria, and other infectious agents have incubation periods and contagious periods unique to them. Because this is an introductory article about stomach flu, readers are recommended to check the incubation periods and contagious periods of whatever infectious agent is thought to be causing the problem (for example, ''Salmonella'' or ''E. coli'').' "
How long does the stomach flu last?,"'For contagious causes of stomach flu, many individuals have symptoms that last about 2 to 5 days, after which the symptoms tend to resolve. Once the symptoms resolve, an individual may be considered ""cured"" of stomach flu. However, it\'s not unusual for that same individual to develop stomach flu again at some point in time if they are exposed to other causes, or in some individuals, the same infectious cause. Occasionally, the stomach flu ""symptoms"" progress and goes on to become another more severe disease (for example, salmonellosis or ''shigellosis'').'  "
How long do the contagious causes of the stomach flu last on surfaces?,"'The most common cause of stomach flu, noroviruses, can live on surfaces for up to about two weeks. Consequently, is important to try to avoid contaminating surfaces while you are infected with the virus and equally important, anyone not infected individual should wash their hands with soap and water after touching surfaces that might be contaminated. Cleaning surfaces like doorknobs or kitchen counters with a diluted bleach and water solution can help reduce the chance of infection.''For other causes of stomach flu (gastroenteritis), the reader is suggested to look up the specific infectious agent to determine how long it will remain viable and contagious on surfaces.' "
When should I contact a doctor for the stomach flu?,"'Many people get contagious stomach flu from different causes, but in general, they recover from the infection in about 2 to 5 days and usually do not contact a health-care professional. Most doctors consider gastroenteritis to be a self-limiting disease. Unfortunately some people, especially the elderly, young children, and individuals that have multiple medical problems may develop more severe symptoms. Consequently, people should contact their health-care professional or emergency department if one or more the following occurs:'   Gastroenteritis symptoms that last more than five days The intensity of the symptoms increases A fever above 101 F or 38.3 C Bloody diarrhea Signs of dehydration appear, for example, little or no urine output or dry mucous membranes Constant or increasing abdominal pains A person is immunocompromised, has other medical problems, or is pregnant Facial or throat swelling Shortness of breath"
What is gastroesophageal junction adenocarcinoma?,"'The esophagus is the tube that allows food to travel from the mouth to the stomach. The lower part of the esophagus that connects to the stomach is called the gastroesophageal (GE) junction. At this location, there is a ring of muscles called the lower esophageal sphincter. This muscular ring controls the movement of food from the esophagus into the stomach. The GE junction lies just below the ''diaphragm'', or ''breathing'' muscle, beneath the ''lungs''.''Cancers'' that start in glandular cells are termed adenocarcinomas. Therefore, a gastroesophageal junction adenocarcinoma is a ''cancer'' that begins in glandular cells located near the GE junction. This ''cancer'' has also been referred to as esophagogastric junction adenocarcinoma.''Gastroesophageal junction adenocarcinomas are staged and treated the same as cancers of the esophagus and are typically considered to be a form of ''esophageal cancer''.''Esophageal cancer'' is four times more common in men than in women. Almost 17,000 cases of new esophageal ''cancer'' cases are diagnosed yearly in the U.S., and the condition causes over 15,500 deaths each year. It is most common in Caucasians, but the incidence rate in African-Americans is almost as high as in whites. Esophageal ''cancer'' is much more common in other parts of the world, including Iran, northern China, India, and southern Africa.' "
What causes gastroesophageal junction adenocarcinoma?,"'The cause of GE junction adenocarcinoma is not well understood. As with all cancers, the DNA from esophageal ''cancer'' cells shows changes in many different genes. But specific genetic changes (mutations) that have been definitively linked to GE junction adenocarcinoma are not well characterized. ''Inherited'"" DNA mutations can increase some people's risk for developing certain cancers, but this does not seem to be the case for esophageal cancer as it does not appear to run in families. There are known risk factors (see below) that can increase your risk of getting esophageal cancer."" "
What are risk factors for gastroesophageal junction adenocarcinoma?,"'Risk factors that can increase the risk of gastroesophageal adenocarcinoma include the following:' Male gender Increasing age (over 85% of cases occur in people over 55) Gastroesophageal reflux disease (GERD) and Barrett's esophagus, a change in the lining of the esophagus that occurs after long-term reflux of stomach acid into the lower esophagus Tobacco use, including chewing tobacco, cigars, and pipes Alcohol use, although alcohol increase the risk of other types of esophageal cancer more than for gastroesophageal adenocarcinoma Obesity Dietary factors: A diet high in fruits and vegetables decrease the risk, while consumption of processed meat may increase the risk. Achalasia, a disorder of movement of the esophagus"
What are gastroesophageal junction adenocarcinoma symptoms and signs?,"'Most esophageal cancers, including gastroesophageal junction adenocarcinomas, do not cause symptoms until they have grown large or spread to an advanced stage. At this point, they cause typical symptoms and signs. The symptoms and signs may include the following:'  Dysphagia, or difficulty swallowing, can be a sense that food is ""stuck"" in the esophagus or not going down properly. Others have described a feeling of choking on food. If the opening of the esophagus is very narrow due to a cancer, people might start avoiding bread and meat due to difficulty eating and switching to a more liquid diet that can pass easily into the stomach. Increased production of saliva: The body compensates for difficulty swallowing by producing more saliva. This can lead to coughing up mucus or excessive saliva. Hoarseness Unintentional weight loss Painful swallowing or heartburn-like chest pain (chronic GERD) or burning Nausea and vomiting Chronic cough or hiccups Black stool from bleeding in the area of the cancer (GI bleeding) Anemia Bone pain, if the cancer has spread to the bones"
What specialists treat gastroesophageal junction adenocarcinoma?,"'A ''gastroenterologist'' typically performs the endoscopic tests that involve biopsies to diagnose gastroesophageal junction adenocarcinoma. If cancer is found, the treatment team typically includes other specialists, including surgeons, oncologists, and ''radiation'' oncologists.' "
