Questions,Answer
How are the results of the glucose tolerance test evaluated?,"'Glucose tolerance tests may lead to one of the following diagnoses:' Normal response: A person is said to have a normal 
  response when the two hour glucose level is less than 140 mg/dl, and all values 
  between 0 and 2 hours are less than 200 mg/dl. Impaired glucose tolerance (IGT): A person is said to have impaired 
  glucose tolerance when the fasting plasma glucose is 
  less than 126 mg/dl and the two hour glucose level is between 140 and 199 
  mg/dl. This is sometimes referred to as ""prediabetes"" because people with IGT 
  have a higher risk of developing diabetes. Diabetes: A person has diabetes when two diagnostic 
  tests done on different days show that the blood glucose level is high. This means either the 
  two hour levels is greater than 200 mg/dl or the fasting glucose is noted as greater than 126 mg/dl.
  A 
  glycosylated hemoglobin (HbA1c) level of 6.5% or more also supports a 
  diagnosis of diabetes mellitus. Diabetes during pregnancy: A pregnant woman has diabetes 
	if she has a fasting plasma glucose of over 92 mg/dl, or a two hour glucose level 
	greater than 153 mg/dl."
What about glucose tolerance testing during pregnancy?,"'As mentioned previously, the glucose tolerance test is used for the diagnosis of ''gestational diabetes'' (diabetes that develops during pregnancy). It may be used if there are equivocal fasting or random blood glucose results, or to screen for gestational diabetes in pregnant women between 24 to 28 weeks of gestation who are not known to have diabetes.\t ''The test may also be used in the postpartum period to detect diabetes in women who had gestational diabetes during pregnancy. Women who had gestational diabetes do not always develop diabetes later in life, but they should undergo diabetes screening at least every three years throughout their life.\t ' "
What is a gluteal injury? What are the types of gluteal injuries?,"'A gluteal ''contusion'' is a bruise to the muscle area. A gluteal muscle strain is a stretch or partial tear of the muscle or tendon.''Trauma'', either by a fall or a direct blow to the buttock area, causes most gluteal injuries.''Overuse injuries of the hip may cause inflammation and damage to the gluteal muscles that help move the hip or to the tendons that attach the gluteal muscles to the greater trochanter of the hip.' "
What causes a gluteal injury?,"'Falls are a common cause of a gluteal or buttock ''contusion''. In patients who are anticoagulated or on blood thinners, a large amount of bleeding can occur within and around the muscle, causing significant ''pain'' and swelling.''Gluteal muscle and tendon ''strains'' occur because of overuse injuries, usually of the hip joint. Repetitive motions like squatting and lifting at work may cause inflammation in tissues surrounding the hip.''In athletes, gluteal tendinopathies may mimic ''hip bursitis''. Injuries may occur because of overtraining, especially with weightlifting and squats.''Inflammation of the hip, piriformis, ''iliotibial band'', and the gluteus muscles are common ''running'' injuries.' "
What are signs and symptoms of a gluteal injury?,"'Falls or direct blows to the buttock can cause bleeding, inflammation, and swelling. This leads to ''pain'', making it difficult to sit on the buttocks, or stand and/or walk normally because of the decreased range of motion of the hip. When the gluteal muscles are inflamed, movement of the hip joint causes ''pain''. Because of bleeding that may be deep and not immediately apparent on the surface of the skin, inflammation may occur causing the buttock to feel swollen, warm, and become slightly red.'  "
How do medical professionals diagnose a gluteal injury?,"'History is the first important step in helping the health care provider make a diagnosis.''Physical examination will focus on the low back, buttock, and hips.' Was there an injury or fall? It is important that other parts of the body be examined to look for other potential injuries. Did it just happen or has the pain been persistent and ongoing? Is this an acute injury, or has it been a chronic ongoing problem? Is the patient able to walk, and if so, is there a limp? Any fall or blow may be associated with fractures or broken bones of the pelvis, hip, or lower back (sacrum, lumbar spine). Is the patient taking blood thinners? Gluteal injuries may have significant bleeding in these patients. Is there any numbness or tingling or pain that radiates down the leg? The health care professional may check for sciatic nerve inflammation and the cause of gluteal or buttock pain. Has there been any issue with the ability to urinate or have a bowel movement? Acute changes in bowel or bladder function are associated with potential spinal cord injury, like cauda equina syndrome, a medical emergency. Inspection or looking at the buttock area might reveal bruising of the skin or the buttock may appear swollen and red. Palpation, or feeling the buttock, may expose tenderness associated with a contusion. The overlying skin might feel warm. Swelling, redness, and warmth may be due to a gluteal contusion but also might signal a deep infection. Examining the hip may uncover pain with tenderness over the joint line or the greater trochanter. This can be associated with gluteal tendinopathy (inflammation and damage of the gluteus tendon that attach the gluteal muscles to the greater trochanter). An injury may decrease hip range of motion. Moving the hip may cause pain in the buttock due to muscle inflammation and damage. X-rays may be done to look for fractures of the hip, pelvis, and lumbar spine. CT scan or MRI may be considered if the health care professional has a high index of suspicion for a hip fracture, but the plain X-rays are normal. Ultrasound may be helpful to look for a large collection of blood deep in the buttock muscle or to look for an abscess if infection is a concern. Blood tests are not usually done, except for patients who take warfarin (Coumadin) as a blood thinner."
What is the treatment for a gluteal injury?,"'Should the gluteal injury be due to a direct blow or fall, resulting in a contusion, treatment aims to decrease the inflammation in the area.''Ice, elevation, and rest may be helpful. Most commonly, gluteus muscle injuries heal with time and no further treatment.''A rubber donut may be used to decrease the pain of sitting on a swollen buttock''Some patients with gluteal injuries have difficulty sitting on the commode and become constipated. A ''stool softener'' may be considered for a short period of time.''If the gluteal injury is due to overuse, or an abnormal gait (pattern of ''walking''), physical therapy may be considered to prevent further injury and inflammation.''Physical therapy may also be helpful in treating tendinopathies and other inflammation of the gluteus muscles not due to trauma. Treatment modalities may include ''massage'' and ''ultrasound''. Rehab may include exercises to strengthen muscles and maintain range of motion to prevent future injury.''In some circumstances, medical professionals may consider administering steroid injections. Using ultrasound, a long needle is guided near the injury site so that the injected steroid can work directed at the site of inflammation.''Surgery is not commonly considered but may be an option when nonsurgical treatments have failed, and torn muscles need to be repaired.'  "
What is the prognosis and recovery time for a gluteal injury?,"'Most traumatic gluteus injuries resolve on their own with time and conservative therapy, but recovery time may be measured in weeks and not days.''Overuse injuries may take longer to heal, but the goal is to return patients to their normal level of function.' "
Is it possible to prevent a gluteal injury?,"'People may sometimes avoid accidental falls. It is important to have good footwear, be aware of surroundings, especially when the weather is rainy, snowy, or icy. This is especially true for elderly patients and those who may have impaired balance. Warming up and stretching before activities may help decrease injury risk.' "
How to determine high vs low-glycemic foods,"'The ''glycemic index'' (GI) is a numeric value assigned to foods based on how slowly or quickly they can increase your blood glucose levels. It is a rating system for carbohydrate-containing foods. Foods having a low GI are the ones that tend to release glucose slowly and steadily. By contrast, foods that fall high on the GI scale release glucose rapidly.''GI is assigned with reference to pure glucose that is arbitrarily given a GI of 100. Thus, if a food has a GI of 30, it means it will boost blood glucose by only 30% compared with pure glucose.''Based upon the GI value, foods are divided into three categories' Low-GI foods: This refers to foods with a GI value of 55 or less. Low-GI foods include most fruits and vegetables, whole or minimally processed grains, beans, pasta, low-fat dairy products and nuts. Moderate-GI foods: Foods belonging to this category have a GI of 56 to 69. They include white potatoes, sweet potatoes, white rice, corn, couscous and breakfast cereals such as Mini-Wheats and Cream of Wheat. High-GI foods: Foods in this category have a GI of 70 or more. Foods with high GI include white bread, cakes, doughnuts, cookies, rice cakes, most crackers, bagels, croissants and most packaged breakfast cereals."
Are eggs a low-glycemic food?,"'Are eggs a low-glycemic food?Eggs are a low-glycemic food. Additionally, they have a satiating effect making the person feel fuller longer. Thus, eggs have the benefit of limiting calorie itake as well. Low-glycemic foods help manage weight and reduce the risk of ''diabetes'', ''heart'' diseases, ''obesity'', nerve damage and certain ''cancers''.''Other foods with a low glycemic index (GI) include''Although low-glycemic foods do not cause erratic blood ''sugar'' spikes, it is important to watch calories while consuming them as well. For example, fats and oils are low-glycemic foods, but too much of these will add calories to the ''diet'' and may cause more harm in the long run.' Most vegetables such as green peas, cabbage, lettuce, spinach, collards, kale, cucumbers, broccoli, zucchini, bok choy and artichokes Certain fruits such as apples, pears, plum, avocado, olives, unripe banana, dried apricots, oranges, coconut, cranberries and blueberries Mushrooms Whole or minimally processed grains such as barley, whole wheat, oat and rice bran cereals, sourdough bread and wheat tortilla Nuts and nut butters  Seeds such as pumpkin, chia, sunflower and flax seeds Poultry such as chicken and turkey Fish and shellfish Meat such as beef and pork Oils such as extra virgin olive oil and canola oil Fats such as lard, shortening and butter Mayonnaise Dairy and dairy-substitute products such as milk, plain yogurt, cheese and soy milk"
Are high-glycemic foods bad for health?,"'High-glycemic foods have a glycemic index (GI) of 70 or more. These foods are not bad if consumed in low to moderate amounts. High-glycemic foods tend to cause more rapid and higher blood ''sugar'' spikes than low-glycemic foods. Blood sugar spikes are considered bad because a ''high blood sugar'' level places a higher demand for the ''insulin'' release on the body. This may cause a substantial drop in blood sugar levels after the spike. The dips cause more hunger, carbohydrate cravings and ''weakness''. Frequent consumption of high-GI foods is associated with higher insulin levels in the body and consequent beta cell ''fatigue'' (reduced insulin production by beta cells).''High-glycemic foods are associated with a higher risk of ''diabetes'', ''heart disease'', obesity, ''high blood pressure'' and certain cancers such as ''colorectal cancer''.''Foods with high GI include white bread, cakes, candies, doughnuts, cookies, rice cakes, most crackers, bagels, croissants and most packaged breakfast cereals.\xa0' "
What is Turner syndrome?,"'Turner syndrome is a chromosomal condition that alters development in females. Women with this condition tend to be shorter than average and are usually unable to conceive a child (''infertile'') because of an absence of ovarian function. Other features of this condition that can vary among women who have Turner syndrome include: extra skin on the neck (webbed neck), puffiness or swelling (''lymphedema'') of the hands and feet, skeletal abnormalities, heart defects and kidney problems.''This condition occurs in about 1 in 2,500 female births worldwide, but is much more common among ''pregnancies'' that do not survive to term (miscarriages and stillbirths).''Turner syndrome is a chromosomal condition related to the X chromosome.''Researchers have not yet determined which genes on the X chromosome are responsible for most signs and symptoms of Turner syndrome. They have, however, identified one gene called SHOX that is important for bone development and growth. Missing one copy of this gene likely causes short stature and skeletal abnormalities in women with Turner syndrome.' "
What are the symptoms for Turner syndrome?,"'Girls who have Turner syndrome are shorter than average. They often have normal height for the first three years of life, but then have a slow growth rate. At ''puberty'' they do not have the usual growth spurt.'""Non-functioning ovaries are another symptom of Turner syndrome. Normally a girl's ovaries begin to produce sex hormones (estrogen and ""'progesterone'') at puberty. This does not happen in most girls who have Turner syndrome. They do not start their periods or develop breasts without hormone treatment at the age of puberty.''Even though many women who have Turner have non-functioning ovaries and are ''infertile'', their vagina and womb are totally normal.''In early childhood, girls who have Turner syndrome may have frequent middle ''ear infections''. Recurrent infections can lead to ''hearing loss'' in some cases.''Girls with Turner Syndrome are usually of normal intelligence with good verbal skills and reading skills. Some girls, however, have problems with math, memory skills and fine-finger movements.''Additional symptoms of Turner syndrome include the following:' An especially wide neck (webbed neck) and a low or indistinct hairline. A broad chest and widely spaced nipples. Arms that turn out slightly at the elbow. A heart murmur, sometimes associated with narrowing of the aorta (blood vessel exiting the heart). A tendency to develop high blood pressure (so this should be checked regularly). Minor eye problems that are corrected by glasses. Scoliosis (deformity of the spine) occurs in 10 percent of adolescent girls who have Turner syndrome. The thyroid gland becomes under-active in about 10 percent of women who have Turner syndrome. Regular blood tests are necessary to detect it early and if necessary treat with thyroid replacement. Older or over-weight women with Turner syndrome are slightly more at risk of developing diabetes. Osteoporosis can develop because of a lack of estrogen, but this can largely be prevented by taking hormone replacement therapy."
How is Turner syndrome diagnosed?,"'A diagnosis of Turner syndrome may be suspected when there are a number of typical physical features observed such as webbed neck, a broad chest and widely spaced nipples. Sometimes diagnosis is made at birth because of heart problems, an unusually wide neck or swelling of the hands and feet.''The two main clinical features of Turner syndrome are short stature and the lack of the development of the ovaries.''Many girls are diagnosed in early childhood when a slow growth rate and other features are identified. Diagnosis sometimes takes place later when puberty does not occur.''Turner syndrome may be suspected in ''pregnancy'' during an ''ultrasound'' test. This can be confirmed by ''prenatal'' testing - chorionic villous sampling or ''amniocentesis'' - to obtain cells from the unborn baby for chromosomal analysis. If a diagnosis is confirmed prenatally, the baby may be under the care of a specialist pediatrician immediately after birth.''Diagnosis is confirmed by a blood test, called a karyotype. This is used to analyze the chromosomal composition of the female. More information about this will be discussed in the section ""Is Turner syndrome inherited?""'  "
What is the treatment for Turner syndrome?,"'During childhood and adolescence, girls may be under the care of a pediatric endocrinologist, who is a specialist in childhood conditions of the hormones and metabolism.''Growth hormone injections are beneficial in some individuals with Turner syndrome. Injections often begin in early childhood and may increase final adult height by a few inches.'""Estrogen replacement therapy is usually started at the time of normal puberty, around 12 years to start breast development. Estrogen and progesterone are given a little later to begin a monthly 'period,' which is necessary to keep the womb healthy. Estrogen is also given to prevent ""'osteoporosis''.''Babies'' born with a ''heart murmur'' or narrowing of the aorta may need surgery to correct the problem. A heart expert (cardiologist) will assess and follow up any treatment necessary.''Girls who have Turner syndrome are more likely to get middle ''ear infections''. Repeated infections may lead to ''hearing loss'' and should be evaluated by the pediatrician. An ear, nose and throat specialist (ENT) may be involved in caring for this health issue.''High blood pressure'' is quite common in women who have Turner syndrome. In some cases, the elevated ''blood pressure'' is due to narrowing of the aorta or a kidney abnormality. However, most of the time, no specific cause for the elevation is identified. Blood pressure should be checked routinely and, if necessary, treated with medication. Women who have Turner syndrome have a slightly higher risk of having an under active thyroid or developing ''diabetes''. This should also be monitored during routine health maintenance visits and treated if necessary.''Regular health checks are very important. Special clinics for the care of girls and women who have Turner syndrome are available in some areas, with access to a variety of specialists. Early preventive care and treatment is very important.''Almost all women are ''infertile'', but pregnancy with donor embryos may be possible.''Having appropriate medical treatment and support allows a woman with Turner syndrome to lead a normal, healthy and happy life.'  "
Is Turner syndrome inherited?,"'Turner syndrome is not usually inherited in families. Turner syndrome occurs when one of the two X chromosomes normally found in women is missing or incomplete. Although the exact cause of Turner syndrome is not known, it appears to occur as a result of a random error during the formation of either the eggs or sperm.'""Humans have 46 chromosomes, which contain all of a person's genes and DNA. Two of these chromosomes, the sex chromosomes, determine a person's gender. Both of the sex chromosomes in females are called X chromosomes. (This is written as XX.) Males have an X and a Y chromosome (written as XY). The two sex chromosomes help a person develop ""'fertility'' and the sexual characteristics of their gender.''In Turner syndrome, the girl does not have the usual pair of two complete X chromosomes. The most common scenario is that the girl has only one X chromosome in her cells. Some girls with Turner syndrome do have two X chromosomes, but one of the X chromosomes is incomplete. In another scenario, the girl has some cells in her body with two X chromosomes, but other cells have only one. This is called mosaicism.'  "
What is gonorrhea? How do you get it?,"'Gonorrhea is a bacterial infection caused by the organism\xa0''Neisseria gonorrhoeae''\xa0that is transmitted during unprotected sex. Gonorrhea is one of the oldest known ''sexually transmitted diseases''. Among individuals who are infected with gonorrhea, 50% to 70% also will be infected with ''chlamydia'', another type of bacteria that causes another ''STD''.''Contrary to popular belief, gonorrhea cannot be transmitted from toilet seats or door handles. The bacterium that causes gonorrhea requires very specific conditions for growth and reproduction. It cannot live outside the body for more than a few seconds or minutes, nor can it live on the skin of the hands, arms, or legs. It survives only on moist surfaces within the body and is found most commonly in the vagina, and, more commonly, the cervix. (The cervix is the end of the uterus that protrudes into the vagina.) It can also live in the tube (urethra) through which urine drains from the bladder. ''Neisseria gonorrhoeae'' can even exist in the back of the throat (from oral sex) and in the rectum (from anal sex).' "
Is gonorrhea an STD?,"'Sexually transmitted diseases (''STDs'') are infections that can be transferred from one sexual partner to another through any type of sexual contact. ''STDs'' are sometimes referred to as sexually transmitted infections (STIs) since they involve the transmission of a disease-causing organism from one person to another during sexual activity. It is important to realize that sexual contact includes more than just sexual intercourse (vaginal and anal). Sexual contact includes kissing, oral sex, and the use of sexual ""toys,"" such as vibrators. STDs probably have been around for thousands of years, but the most dangerous of these conditions, the ''acquired immunodeficiency syndrome'' (''AIDS'') was first recognized in 1981, and the causative\xa0''human immunodeficiency virus''\xa0(''HIV''), was first identified in 1984.''Many STDs are treatable, but effective cures are lacking for others, such as ''HIV'', ''HPV''\xa0(human papilloma virus), and possibly\xa0''hepatitis B''. Even gonorrhea, once easily cured, has become resistant to many of the older traditional antibiotics. Many STDs can be present in, and spread by, people who do not have any symptoms of the condition and have not yet been diagnosed with an STD. Therefore, public awareness and education about these infections and the methods of preventing them is important.''There really is no such thing as ""safe"" sex. The only truly effective way to prevent STDs is abstinence. Sex in the context of a monogamous relationship wherein neither party is infected with a STD also is considered ""safe."" Most people think that kissing is a safe activity. Unfortunately, ''syphilis'', ''herpes'', and other infections can be contracted through this relatively simple and apparently harmless act. All other forms of sexual contact carry some risk. ''Condoms'' are commonly thought to protect against STDs. While condoms are useful in decreasing the spread of certain infections, such as ''chlamydia'' and gonorrhea, they do not fully protect against other infections such as ''genital herpes'', ''genital warts'', ''syphilis'', and ''AIDS''. ''Prevention'' of the spread of STDs is dependent upon the counseling of at-risk individuals and the early diagnosis and treatment of infections.' "
What are the early symptomssigns and of gonorrhea? What symptoms develop later?,"'Most infected women have no symptoms, especially in the early stages of the infection.''Gonorrhea symptoms and signs include:''Untreated gonorrhea can lead to a severe pelvic infection with inflammation of the Fallopian tubes and ovaries. Gonorrheal infection of the Fallopian tubes can lead to a serious, painful infection of the pelvis known as ''pelvic inflammatory disease'' or PID. PID occurs in many women with gonorrheal infection of the uterine cervix. Symptoms of pelvic infection include ''fever'', pelvic cramping, ''pelvic pain'', or ''pain'' with intercourse. Pelvic infection can lead to difficulty in ''becoming pregnant'' or even ''infertility'' because of tubal damage or obstruction. Occasionally, if the infection is severe enough, a localized area of infection and pus-like discharge (an abscess) forms (tubo-ovarian abscess) that can be life-threatening, and major surgery may be necessary. Gonorrhea infections in people with conditions causing seriously ''depressed'' immune function, such as ''AIDS'' or immunosuppressive treatments, can be even more serious.'  Burning Frequent, and/or painful urination Yellowish vaginal discharge Redness and swelling of the genitals Burning or itching of the vaginal area Sore throat"
How is gonorrhea diagnosed?,"'Testing for gonorrhea is done by swabbing the infected site (rectum, throat, cervix) and identifying the bacteria in the laboratory either through culturing of the material from the swab (growing the bacteria) or identification of the genetic material from the bacteria. Sometimes the tests do not show bacteria because of sampling errors (the sampled area does not contain bacteria) or other technical difficulties, even when the woman has an infection. Newer tests to diagnose gonorrhea involve the use of DNA probes or amplification techniques (for example, ''polymerase chain reaction'', or ''PCR'') to identify the genetic material of the bacteria. These tests are more expensive than cultures but typically yield more rapid results.' "
