Questions,Answer
What is glucose-6-phosphate dehydrogenase deficiency?,"'Glucose-6-phosphate dehydrogenase deficiency is a genetic disorder that occurs most often in males. This condition mainly affects red blood cells, which carry oxygen from the lungs to tissues throughout the body. In affected individuals, a defect in an enzyme called glucose-6-phosphate dehydrogenase causes red blood cells to break down prematurely. This destruction of red blood cells is called hemolysis.''The most common medical problem associated with glucose-6-phosphate dehydrogenase deficiency is hemolytic anemia, which occurs when red blood cells are destroyed faster than the body can replace them. This type of anemia leads to paleness, yellowing of the skin and whites of the eyes (''jaundice''), dark urine, ''fatigue'', shortness of breath, and a rapid heart rate. In people with glucose-6-phosphate dehydrogenase deficiency, hemolytic anemia is most often triggered by bacterial or viral infections or by certain drugs (such as some antibiotics and medications used to treat ''malaria''). Hemolytic anemia can also occur after eating fava beans or inhaling ''pollen'' from fava plants (a reaction called favism).''Glucose-6-dehydrogenase deficiency is also a significant cause of mild to severe jaundice in newborns. Many people with this disorder, however, never experience any signs or symptoms.'  "
How common is glucose-6-phosphate dehydrogenase deficiency?,"'An estimated 400 million people worldwide have glucose-6-phosphate dehydrogenase deficiency. This condition occurs most frequently in certain parts of Africa, Asia, and the Mediterranean. It affects about 1 in 10 African-American males in the United States.' "
What genes are related to glucose-6-phosphate dehydrogenase deficiency?,"'Mutations in the G6PD gene cause glucose-6-phosphate dehydrogenase deficiency.''The G6PD gene provides instructions for making an enzyme called glucose-6-phosphate dehydrogenase. This enzyme is involved in the normal processing of carbohydrates. It also protects red blood cells from the effects of potentially harmful molecules called reactive oxygen species. Reactive oxygen species are byproducts of normal cellular functions. Chemical reactions involving glucose-6-phosphate dehydrogenase produce compounds that prevent reactive oxygen species from building up to toxic levels within red blood cells.''If mutations in the G6PD gene reduce the amount of glucose-6-phosphate dehydrogenase or alter its structure, this enzyme can no longer play its protective role. As a result, reactive oxygen species can accumulate and damage red blood cells. Factors such as infections, certain drugs, or ingesting fava beans can increase the levels of reactive oxygen species, causing red blood cells to be destroyed faster than the body can replace them. A reduction in the amount of red blood cells causes the signs and symptoms of hemolytic anemia.''Researchers believe that carriers of a G6PD mutation may be partially protected against ''malaria'', an infectious disease carried by a certain type of mosquito. A reduction in the amount of functional glucose-6-dehydrogenase appears to make it more difficult for this parasite to invade red blood cells. Glucose-6-phosphate dehydrogenase deficiency occurs most frequently in areas of the world where malaria is common.' "
How do people inherit glucose-6-phosphate dehydrogenase deficiency?,"'This condition is ''inherited'' in an X-linked recessive pattern. The gene associated with this condition is located on the X chromosome, which is one of the two sex chromosomes. In males (who have only one X chromosome), one altered copy of the gene in each cell is sufficient to cause the condition. In females (who have two X chromosomes), a mutation would have to occur in both copies of the gene to cause the disorder. Because it is unlikely that females will have two altered copies of this gene, males are affected by X-linked recessive disorders much more frequently than females. A striking characteristic of X-linked inheritance is that fathers cannot pass X-linked traits to their sons.' "
What other names do people use for glucose-6-phosphate dehydrogenase deficiency?, Deficiency of glucose-6-phosphate dehydrogenase G6PDD G6PD Deficiency
What is glucose-6-phosphate dehydrogenase deficiency?,"'Glucose-6-phosphate dehydrogenase deficiency is a genetic disorder that occurs most often in males. This condition mainly affects red blood cells, which carry oxygen from the lungs to tissues throughout the body. In affected individuals, a defect in an enzyme called glucose-6-phosphate dehydrogenase causes red blood cells to break down prematurely. This destruction of red blood cells is called hemolysis.''The most common medical problem associated with glucose-6-phosphate dehydrogenase deficiency is hemolytic anemia, which occurs when red blood cells are destroyed faster than the body can replace them. This type of anemia leads to paleness, yellowing of the skin and whites of the eyes (''jaundice''), dark urine, ''fatigue'', shortness of breath, and a rapid heart rate. In people with glucose-6-phosphate dehydrogenase deficiency, hemolytic anemia is most often triggered by bacterial or viral infections or by certain drugs (such as some antibiotics and medications used to treat ''malaria''). Hemolytic anemia can also occur after eating fava beans or inhaling ''pollen'' from fava plants (a reaction called favism).''Glucose-6-dehydrogenase deficiency is also a significant cause of mild to severe jaundice in newborns. Many people with this disorder, however, never experience any signs or symptoms.'  "
How common is glucose-6-phosphate dehydrogenase deficiency?,"'An estimated 400 million people worldwide have glucose-6-phosphate dehydrogenase deficiency. This condition occurs most frequently in certain parts of Africa, Asia, and the Mediterranean. It affects about 1 in 10 African-American males in the United States.' "
What genes are related to glucose-6-phosphate dehydrogenase deficiency?,"'Mutations in the G6PD gene cause glucose-6-phosphate dehydrogenase deficiency.''The G6PD gene provides instructions for making an enzyme called glucose-6-phosphate dehydrogenase. This enzyme is involved in the normal processing of carbohydrates. It also protects red blood cells from the effects of potentially harmful molecules called reactive oxygen species. Reactive oxygen species are byproducts of normal cellular functions. Chemical reactions involving glucose-6-phosphate dehydrogenase produce compounds that prevent reactive oxygen species from building up to toxic levels within red blood cells.''If mutations in the G6PD gene reduce the amount of glucose-6-phosphate dehydrogenase or alter its structure, this enzyme can no longer play its protective role. As a result, reactive oxygen species can accumulate and damage red blood cells. Factors such as infections, certain drugs, or ingesting fava beans can increase the levels of reactive oxygen species, causing red blood cells to be destroyed faster than the body can replace them. A reduction in the amount of red blood cells causes the signs and symptoms of hemolytic anemia.''Researchers believe that carriers of a G6PD mutation may be partially protected against ''malaria'', an infectious disease carried by a certain type of mosquito. A reduction in the amount of functional glucose-6-dehydrogenase appears to make it more difficult for this parasite to invade red blood cells. Glucose-6-phosphate dehydrogenase deficiency occurs most frequently in areas of the world where malaria is common.' "
How do people inherit glucose-6-phosphate dehydrogenase deficiency?,"'This condition is ''inherited'' in an X-linked recessive pattern. The gene associated with this condition is located on the X chromosome, which is one of the two sex chromosomes. In males (who have only one X chromosome), one altered copy of the gene in each cell is sufficient to cause the condition. In females (who have two X chromosomes), a mutation would have to occur in both copies of the gene to cause the disorder. Because it is unlikely that females will have two altered copies of this gene, males are affected by X-linked recessive disorders much more frequently than females. A striking characteristic of X-linked inheritance is that fathers cannot pass X-linked traits to their sons.' "
What other names do people use for glucose-6-phosphate dehydrogenase deficiency?, Deficiency of glucose-6-phosphate dehydrogenase G6PDD G6PD Deficiency
Gallbladder cancer is a disease in which malignant (cancer) cells form in the tissues of the gallbladder.,"'Gallbladder cancer is a rare disease in which malignant (cancer) cells are found in the tissues of the gallbladder. The gallbladder is a pear-shaped organ that lies just under the liver in the upper abdomen. The gallbladder stores bile, a fluid made by the liver to help digest fat. When food is being broken down in the stomach and ''intestines'', bile is released from the gallbladder through a tube called the common bile duct, which connects the gallbladder and liver to the first part of the small intestine. ''The wall of the gallbladder has 3 main layers of tissue. ''Between these layers is supporting connective tissue. Primary gallbladder cancer starts in the innermost layer and spreads through the outer layers as it grows. ' Mucosal (innermost) layer. Muscularis (middle, muscle) layer. Serosal (outer) layer."
Being female can increase the risk of developing gallbladder cancer.,'Anything that increases your chance of getting a disease is called a risk factor. Risk factors for gallbladder cancer include the following: ' Being female. Being Native American.
"Possible signs of gallbladder cancer include jaundice, pain, and fever.",'These and other symptoms may be caused by gallbladder cancer. Other conditions may cause the same symptoms. A doctor should be consulted if any of the following problems occur: '   Jaundice (yellowing of the skin and whites of the eyes). Pain above the stomach. Fever. Nausea and vomiting. Bloating. Lumps in the abdomen.
Gallbladder cancer is difficult to detect (find) and diagnose early.,"'Gallbladder cancer is difficult to detect and diagnose for the following reasons: ''Gallbladder cancer is sometimes found when the gallbladder is removed for other reasons. Patients with ''gallstones'' rarely develop gallbladder cancer. ''Procedures that create pictures of the gallbladder and the area around it help diagnose gallbladder cancer and show how far the cancer has spread. The process used to find out if cancer cells have spread within and around the gallbladder is called staging. ''In order to plan treatment, it is important to know if the gallbladder cancer can be removed by surgery. Tests and procedures to detect, diagnose, and stage gallbladder cancer are usually done at the same time. The following tests and procedures may be used: '   There aren't any noticeable signs or symptoms in the early stages of gallbladder cancer. The symptoms of gallbladder cancer, when present, are like the symptoms of many other illnesses. The gallbladder is hidden behind the liver. Physical exam and history: An exam of the body to check general signs of health, including checking for signs of disease, such as lumps or anything else that seems unusual. A history of the patient's health habits and past illnesses and treatments will also be taken. Ultrasound exam: A procedure in which high-energy sound waves (ultrasound) are bounced off internal tissues or organs and make echoes. The echoes form a picture of body tissues called a sonogram. An abdominal ultrasound is done to diagnose gallbladder cancer. Liver function tests: A procedure in which a blood sample is checked to measure the amounts of certain substances released into the blood by the liver. A higher than normal amount of a substance can be a sign of liver disease that may be caused by gallbladder cancer. Carcinoembryonic antigen (CEA) assay: A test that measures the level of CEA in the blood. CEA is released into the bloodstream from both cancer cells and normal cells. When found in higher than normal amounts, it can be a sign of gallbladder cancer or other conditions. CA 19-9 assay: A test that measures the level of CA 19-9 in the blood. CA 19-9 is released into the bloodstream from both cancer cells and normal cells. When found in higher than normal amounts, it can be a sign of gallbladder cancer or other conditions. CT scan (CAT scan): A procedure that makes a series of detailed pictures of areas inside the body, taken from different angles. The pictures are made by a computer linked to an X-ray machine. A dye may be injected into a vein or swallowed to help the organs or tissues show up more clearly. This procedure is also called computed tomography, computerized tomography, or computerized axial tomography. Blood chemistry studies: A procedure in which a blood sample is checked to measure the amounts of certain substances released into the blood by organs and tissues in the body. An unusual (higher or lower than normal) amount of a substance can be a sign of disease in the organ or tissue that produces it. Chest X-ray: An X-ray of the organs and bones inside the chest. An X-ray is a type of energy beam that can go through the body and onto film, making a picture of areas inside the body. MRI (magnetic resonance imaging): A procedure that uses a magnet, radio waves, and a computer to make a series of detailed pictures of areas inside the body. This procedure is also called nuclear magnetic resonance imaging (NMRI). A dye may be injected into the gallbladder area so the ducts (tubes) that carry bile from the liver to the gallbladder and from the gallbladder to the small intestine will show up better in the image. This procedure is called MRCP (magnetic resonance cholangiopancreatography). To create detailed pictures of blood vessels near the gallbladder, the dye is injected into a vein. This procedure is called MRA (magnetic resonance angiography). ERCP (endoscopic retrograde cholangiopancreatography): A procedure used to X-ray the ducts (tubes) that carry bile from the liver to the gallbladder and from the gallbladder to the small intestine. Sometimes gallbladder cancer causes these ducts to narrow and block or slow the flow of bile, causing jaundice. An endoscope (a thin, lighted tube) is passed through the mouth, esophagus, and stomach into the first part of the small intestine. A catheter (a smaller tube) is then inserted through the endoscope into the bile ducts. A dye is injected through the catheter into the ducts and an X-ray is taken. If the ducts are blocked by a tumor, a fine tube may be inserted into the duct to unblock it. This tube (or stent) may be left in place to keep the duct open. Tissue samples may also be taken. Biopsy: The removal of cells or tissues so they can be viewed under a microscope by a pathologist to check for signs of cancer. The biopsy may be done after surgery to remove the tumor. If the tumor clearly cannot be removed by surgery, the biopsy may be done using a fine needle to remove cells from the tumor. Laparoscopy: A surgical procedure to look at the organs inside the abdomen to check for signs of disease. Small incisions (cuts) are made in the wall of the abdomen and a laparoscope (a thin, lighted tube) is inserted into one of the incisions. Other instruments may be inserted through the same or other incisions to perform procedures such as removing organs or taking tissue samples for biopsy. The laparoscopy helps to determine if the cancer is within the gallbladder only or has spread to nearby tissues and if it can be removed by surgery. PTC (percutaneous transhepatic cholangiography): A procedure used to X-ray the liver and bile ducts. A thin needle is inserted through the skin below the ribs and into the liver. Dye is injected into the liver or bile ducts and an X-ray is taken. If a blockage is found, a thin, flexible tube called a stent is sometimes left in the liver to drain bile into the small intestine or a collection bag outside the body."
Certain factors affect the prognosis (chance of recovery) and treatment options.,"'The prognosis (chance of recovery) and treatment options depend on the following: ''Treatment may also depend on the age and general health of the patient and whether the cancer is causing symptoms. '""Gallbladder cancer can be cured only if it is found before it has spread, when it can be removed by surgery. If the cancer has spread, palliative treatment can improve the patient's quality of life by controlling the symptoms and complications of this disease. ""'Taking part in one of the ''clinical trials'' being done to improve treatment should be considered. Information about ongoing clinical trials is available from the NCI Web site. ' The stage of the cancer (whether the cancer has spread from the gallbladder to other places in the body). Whether the cancer can be completely removed by surgery. The type of gallbladder cancer (how the cancer cell looks under a microscope). Whether the cancer has just been diagnosed or has recurred (come back)."
Stages of Gallbladder Cancer,"'Tests and procedures to stage gallbladder cancer tell the doctor the extent of the cancer. The testing necessary to learn if the disease is localized or not is usually done at the same time as diagnosis. ''See the General Information section for a description of tests and procedures used to detect, diagnose, and stage gallbladder cancer. ''In stage 0, abnormal cells are found in the innermost (mucosal) layer of the gallbladder. These abnormal cells may become cancer and spread into nearby normal tissue. Stage 0 is also called ''carcinoma in situ''. ''In stage I, cancer has formed. Stage I is divided into stage IA and stage IB.''Stage II is divided into stage IIA and stage IIB. ''In stage III, cancer has spread to a main blood vessel in the liver or to nearby organs and may have spread to nearby lymph nodes. ''In stage IV, cancer has spread to nearby lymph nodes and/or to organs far away from the gallbladder. ''Cancer is found in the wall of the gallbladder and can be completely removed by surgery. ''Cancer has spread through the wall of the gallbladder to surrounding tissues or organs or throughout the abdominal ''cavity''. Except in patients whose cancer has spread only to lymph nodes, the cancer is unresectable (cannot be completely removed by surgery). ''Recurrent gallbladder cancer is cancer that has recurred (come back) after it has been treated. The cancer may come back in the gallbladder or in other parts of the body. ' Stage IA: Cancer has spread beyond the innermost (mucosal) layer to the connective tissue or to the muscle (muscularis) layer. Stage IB: Cancer has spread beyond the muscle layer to the connective tissue around the muscle. Stage IIA: Cancer has spread beyond the visceral peritoneum (a thin layer of tissue that covers the gallbladder) and/or to the liver and/or one nearby organ (such as the stomach, small intestine, colon, pancreas, or bile ducts outside the liver). Stage IIB: Cancer has spread: beyond the innermost layer to the connective tissue and to nearby lymph nodes; or to the muscle layer and nearby lymph nodes; or beyond the muscle layer to the connective tissue around the muscle and to nearby lymph nodes; or through the visceral peritoneum (tissue that covers the gallbladder) and/or to the liver and/or to one nearby organ (such as the stomach, small intestine, colon, pancreas, or bile ducts outside the liver), and to nearby lymph nodes."
Treatment Option Overview,"'There are different types of treatment for patients with gallbladder cancer.''Different types of treatments are available for patients with gallbladder cancer. Some treatments are standard (the currently used treatment), and some are being tested in clinical trials. Before starting treatment, patients may want to think about taking part in a clinical trial. A treatment clinical trial is a research study meant to help improve current treatments or obtain information on new treatments for patients with cancer. When clinical trials show that a new treatment is better than the standard treatment, the new treatment may become the standard treatment. ''Clinical trials are taking place in many parts of the country. Information about ongoing clinical trials is available from the NCI Web site. Choosing the most appropriate cancer treatment is a decision that ideally involves the patient, family, and health care team. ''Gallbladder cancer may be treated with a cholecystectomy, surgery to remove the gallbladder and some of the tissues around it. Nearby lymph nodes may be removed. A laparoscope is sometimes used to guide gallbladder surgery. The laparoscope is attached to a video camera and inserted through an incision (port) in the abdomen. Surgical instruments are inserted through other ports to perform the surgery. Because there is a risk that gallbladder cancer cells may spread to these ports, tissue surrounding the port sites may also be removed.''If the cancer has spread and cannot be removed, the following types of palliative surgery may relieve symptoms: ''Radiation therapy'' is a cancer treatment that uses high-energy ''X-rays'' or other types of radiation to kill cancer cells. There are two types of radiation therapy. External radiation therapy uses a machine outside the body to send radiation toward the cancer. Internal radiation therapy uses a radioactive substance sealed in needles, seeds, wires, or catheters that are placed directly into or near the cancer. The way the radiation therapy is given depends on the type and stage of the cancer being treated. ''Chemotherapy is a cancer treatment that uses ''drugs'' to stop the growth of cancer cells, either by killing the cells or by stopping the cells from dividing. When chemotherapy is taken by mouth or injected into a vein or muscle, the drugs enter the bloodstream and can reach cancer cells throughout the body (systemic chemotherapy). When chemotherapy is placed directly into the spinal column, an organ, or a body ''cavity'' such as the abdomen, the drugs mainly affect cancer cells in those areas (regional chemotherapy). The way the chemotherapy is given depends on the type and stage of the cancer being treated. ''Radiosensitizers are drugs that make tumor cells more sensitive to radiation therapy. Combining radiation therapy with radiosensitizers may kill more tumor cells. ''This summary section refers to specific treatments under study in clinical trials, but it may not mention every new treatment being studied. Information about ongoing clinical trials is available from the NCI Web site. ''Treatment of localized gallbladder cancer may include the following: ''This summary section refers to specific treatments under study in clinical trials, but it may not mention every new treatment being studied. Information about ongoing clinical trials is available from the NCI Web site. '""Check for clinical trials from NCI's PDQ Cancer Clinical Trials Registry that are now accepting patients with localized gallbladder cancer. ""'Treatment of unresectable gallbladder cancer may include the following: ''This summary section refers to specific treatments under study in clinical trials, but it may not mention every new treatment being studied. Information about ongoing clinical trials is available from the NCI Web site. '""Check for clinical trials from NCI's PDQ Cancer Clinical Trials Registry that are now accepting patients with unresectable gallbladder cancer. ""'Treatment of recurrent gallbladder cancer depends on where the cancer has recurred. It is usually done in a clinical trial. ''Information about ongoing clinical trials is available from the NCI Web site.'""Check for clinical trials from NCI's PDQ Cancer Clinical Trials Registry that are now accepting patients with recurrent gallbladder cancer. ""   Surgical biliary bypass: If the tumor is blocking the small intestine and bile is building up in the gallbladder, a biliary bypass may be done. During this operation, the gallbladder or bile duct will be cut and sewn to the small intestine to create a new pathway around the blocked area. Endoscopic stent placement: If the tumor is blocking the bile duct, surgery may be done to put in a stent (a thin, flexible tube) to drain bile that has built up in the area. The stent may be placed through a catheter that drains to the outside of the body or the stent may go around the blocked area and drain the bile into the small intestine. Percutaneous transhepatic biliary drainage: A procedure done to drain bile when there is a blockage and endoscopic stent placement is not possible. An X-ray of the liver and bile ducts is done to locate the blockage. Images made by ultrasound are used to guide placement of a stent, which is left in the liver to drain bile into the small intestine or a collection bag outside the body. This procedure may be done to relieve jaundice before surgery. Surgery to remove the gallbladder and some of the tissue around it. The liver and nearby lymph nodes may also be removed. Radiation therapy with or without chemotherapy may follow surgery. Radiation therapy with or without chemotherapy. A clinical trial of radiation therapy with radiosensitizers. Radiation therapy as palliative treatment, with or without surgery or the placement of stents, to relieve symptoms caused by blocked bile ducts. Surgery as palliative treatment to relieve symptoms caused by blocked bile ducts. Chemotherapy as palliative treatment to relieve symptoms caused by the cancer. A clinical trial of internal radiation therapy or radiosensitizers. A clinical trial of chemotherapy."
