Questions,Answer
How do health care providers diagnose genital herpes?,"'In most cases in which the characteristic signs and symptoms are present, they are sufficient to establish a diagnosis of genital herpes infection. Laboratory tests, such as viral culture and nucleic acid amplification (''polymerase chain reaction'' or ''PCR'') tests to detect the genetic material of the virus, are also available.''Immunologic tests to identify antibodies to genital herpes are other possible tests to establish whether infection has occurred.' "
What are medications and treatment options for genital herpes?,"'Antiviral medicines are available that can help manage the severity and duration of outbreaks, if taken immediately prior to (when there are tingling or unusual skin sensations but no blisters) or within 24 hours of a herpes outbreak. The medications typically used are''These are all typically taken by mouth. In severe cases of viral infection, antiviral medications may be given intravenously, but this is not usually needed for herpes. Topical medications that are applied directly to the herpes sores are also available, but these are less effective than oral medications and are not generally used.''All of these medications may also be given daily as suppressive therapy to decrease the number of outbreaks in people who have frequent herpes outbreaks (more than six outbreaks per year).' 

Read Doctor's View
  acyclovir (Zovirax), famciclovir (Famvir), or valacyclovir (Valtrex)."
How do doctors manage genital herpes during pregnancy?,"'Oral antiviral medications as described above may be used during pregnancy. One serious concern with genital herpes in pregnancy is transmission of the infection to the baby during delivery. In an infant, genital herpes infection can spread through the bloodstream and have serious consequences. Cesarean delivery (''C-section'') is performed for women who go into ''labor'' while there is an active outbreak of genital herpes in order to prevent infection of the baby during birth.''The American College of Obstetricians and Gynecologists recommends that pregnant women with recurrent genital herpes be offered oral antiviral medication at or beyond 36 weeks until delivery in order to increase the chances of being able to deliver vaginally.' "
Are home remedies or natural treatments effective for genital herpes?,"'There are no home or natural remedies available for genital herpes, and as mentioned above, the infection cannot be cured. Home cares such as warm baths, keeping the blisters dry after washing, and wearing loose-fitting, cotton underwear may help soothe symptoms.' "
"What is the prognosis for 
a person with genital herpes?","'As discussed previously, there is no cure for genital herpes infection, and the infection persists for life. People vary in the number and severity of outbreaks they experience. For those with frequent outbreaks, taking antiviral medications as suppressive therapy can decrease the frequency of outbreaks.' "
What kind of doctors treat genital herpes?,"'Genital herpes is treated by primary care providers including internal medicine and family medicine specialists, as well as pediatricians for adolescents. For women, gynecologists are often the treating physicians. In certain circumstances, other specialists may be consulted, including urologists and infectious disease specialists.' "
Is there a link between genital herpes and HIV?,"'The ''HIV'' virus that causes ''AIDS'' is not the same as the genital herpes virus. However, having the ulcers and sores of herpes makes it more likely to contract ''HIV'' if exposed, or to transmit ''HIV'' if you have been infected. The ulcers of genital herpes cause breaks in the skin that make spreading the HIV virus to a sex partner more likely during sexual contact.' "
Is it possible to prevent genital herpes?," Herpes can be spread both during an outbreak and by infected people even when there is no outbreak of the condition, so prevention can be difficult. While condoms may help prevent the spread of genital herpes to sexual partners during sexual activity, the infection also can be spread from skin contact in areas not covered by a condom, or during oral to genital contact. If you are having an outbreak, thorough hand washing and not sharing clothing that has touched the herpes sores can also help prevent transmitting the virus to others."
Genital Herpes: Common but Misunderstood,"'Genital herpes'' and ''cold sores'' (''oral herpes'') are the names given to two types of infection caused by the two types of ''herpes'' simplex virus (HSV): HSV-1 and HSV-2.''HSV-1 (oral herpes) most commonly affects the oral regions (around the mouth, on the lips, face, and tongue) and results in sores (referred to as ''cold sores'') or ''blisters'' in these regions. HSV-2 (genital herpes) most commonly forms ulcers on the penis, scrotum, anus, and the buttocks.''Clearing the myths by creating awareness regarding the true facts of herpes is crucial to help its further spread. Here are some widespread myths or misconceptions and the associated facts about genital herpes and ''cold sores''.''Myth 1:'' You can know if your partner has herpes by its symptoms.''Fact:'' Around eight of 10 people, who get the herpes simplex ''viruses'' (HSV), do not develop any signs or symptoms. The virus can remain dormant in the body and fail to show any symptoms until the person’s immunity becomes weak.''Myth 2:'' A person who has no symptoms is not infectious.''Fact:'' People with herpes may transmit infections via saliva, genital secretions, or sores. The person may or may not have a sore, but the infection is still possible. A study has shown that even without the sores; 10% of the time, carriers of the herpes virus are infectious. The infection may occur via oral contact, genital contact, or even skin to skin contact.''Myth 3:'' Genital herpes can spread only when you ''sleep'' around with people or have penetrating sex.''Fact:'' Though genital herpes spreads most commonly through sex or even through genital-genital contact, it can also spread when a person has oral sex with an infected person.''Myth 4:'' Only certain people can get herpes.''Fact:'' Anyone who is sexually active is at risk of catching the herpes virus. This is because herpes is mainly transmitted sexually, and many people around are asymptomatic carriers, so you never know from whom you can get the infection.''Myth 5: ''Genital herpes is uncommon and there are fewer chances that you will get it.''Fact:'' It is estimated that, globally, over half a billion people between the ages of 15-49 years have genital herpes infection.''The herpes virus is the most common cause of genital ulcers in the United States. At least one out of every six people aged between 14 to 49 years are affected with genital herpes.''Myth 6: ''Condoms'' are a sure way to protect against genital herpes.''Fact: ''Doctors always recommend wearing a ''condom'' for protection against ''sexually transmitted diseases'' (''STD''), such as herpes. Using condoms can reduce your risk of getting herpes, but it is not 100% effective in preventing the infection. This is because the virus can also be present on the noninfectious part of the penis, which the condom cannot cover.''Myth 7:'' Herpes can be transmitted through blood.''Fact:'' Herpes is not present in the blood and only its antibodies can be detected from the blood, which can help confirm if the person had a prior active herpes infection. It cannot be passed via blood and people with genital herpes can still donate blood. Only skin to skin contact is essential for the spread of genital herpes, which can be both orally and genitally.''Myth 8:'' If you have genital herpes, you cannot have children.''Fact:'' Herpes does not affect the childbearing capacity in either of the two sexes. There is a slight chance that the ''pregnant'' lady can pass the herpes virus to her baby during delivery. However, some prescription medicines from a doctor can help prevent the mother to baby virus transmission.''Myth 9:'' Herpes can cause ''cervical cancer''.''Fact:'' There are neither any reports nor any evidence that suggests that the herpes virus can cause ''cancer''. The virus that causes ''genital warts'', ''human papillomavirus'' (''HPV''), is known to increase the risk of ''cervical cancer'' amongst women.''Myth 10: ''Herpes is a deadly disease.''Fact:'' It is not a life-threatening condition, but herpes is a lifelong infection that has no cure. It is associated with a few outbreaks that occur when the person’s immunity is weak. People only need to manage the discomfort of the sores by taking antiviral medications.' "
What is genital herpes?,"'Genital herpes is a common sexually transmitted infection (STI) caused by an infection with the herpes simplex virus (HSV). There are two types of herpes.''However, both types of herpes simplex virus can infect the mouth or the genital areas, meaning that genital contact (oral sex) with a ''cold sore'' on the mouth can lead to genital herpes. Likewise, kissing someone with a ''cold'' sore can spread the herpes simplex virus infection.'""After the first outbreak of herpes, the virus travels through the nerves and resides in nerve tissue within the body. Reactivations, or repeat occurrences of the blisters, can occur throughout an individual's lifetime. Among people aged 14 to 49, an estimated one out of every six people have the infection.""'Genital herpes is not the same thing as ''genital warts''. ''Genital warts'' are flesh-colored growths that appear on the sexually exposed areas due to infection with certain types of ''human papillomavirus'' (''HPV'').' HSV-1 is most commonly associated with blisters and ulcers around the mouth known as cold sores (oral herpes). HSV-2 is associated with blistering lesions in genital areas that are exposed during sexual contact."
How common is genital herpes?," Herpes is very common. Among people aged 14 to 49, an estimated one out of every six people (15.5% of the population) have been infected with HSV-2, the virus that is predominantly responsible for genital herpes. Estimates suggest that in the U.S., 776,000 people become infected every year. The viral infection is more common in women than in men. Spread from men to women is known to occur more readily than from women to men. According to WHO estimates, HSV-1 infects 67% of all humans under the age of 50. The majority of infected people are not aware they are infected."
What are genital herpes symptoms and signs?,"'Many people infected with genital herpes have mild symptoms or symptoms that are mistaken for another condition. It also is possible to be infected with the virus and have no herpes symptoms. Not every woman who is infected may be aware of the infection.''When signs and symptoms are present, they consist of:''With the first outbreak of genital herpes, a person may also experience ''flu-like symptoms'' including:''Immediately prior to an outbreak, there may be an ''itching'', burning, or tingling sensation of the skin.''In women, genital herpes usually causes blistering lesions on the vulva and around the vaginal opening that progress to ulcer formation. The infection spreads to involve the cervix in most cases, leading to cervicitis (inflammation of the cervix). In some women, cervicitis may be the only sign of genital herpes infection. Infection and inflammation of the urethra accompanies the infection in some women, leading to ''pain'' on urination.''After the initial infection, a person may or may not have outbreaks later in life.'  Typically painful fluid-filled blisters (that may appear like ""pimples"") around the vaginal area Blisters around the vagina, anus, or buttocks Ulcer formation after the blisters break open Blisters take 2 to 4 weeks to heal. Fever Chills Body aches Swollen lymph nodes"
What causes genital herpes? How does it spread?,"'The herpes ''viruses'' enter the skin or mucous membrane through tiny, even microscopic, breaks in the tissue when there is skin-to-skin contact with an infected person. Because an infected person may spread the disease even when he or she does not have signs or ''symptoms of herpes'', avoiding sexual contact with someone with active blisters does not guarantee protection against the infection. Even normal appearing skin can spread the infection. Clothing that touches genital skin ulcers may transmit herpes simplex virus to others that wear the clothing.''The average incubation period (time until symptoms develop) after exposure is 4 days, but symptoms may develop anywhere from 2 to 12 days after you have been exposed to the virus.''Individual outbreaks of herpes vary among affected people in terms of their frequency and severity. Outbreaks can be related to the function of the immune system and are typically worse in cases in which the immune system is suppressed. For example, at times of physical or emotional ''stress'', during illness, or when taking certain medications, genital herpes outbreaks may be more likely.' "
How do you get genital herpes (transmission)?, Herpes simplex virus infection is transmitted by direct person-to-person contact. Genital herpes is acquired through sexual contact of any type that involves contact with the genital areas. Genital herpes also can be caused by mouth to genital contact (oral sex) with a person who has cold sores or herpes infection of the mouth. Transmission of herpes from an infected male to a female partner is more likely than transmission from an infected woman to a male partner.
Is there a cure for genital herpes?,"""There is no cure for genital herpes, and once a person is infected with genital herpes, the infection persists throughout the individual's life, with the potential for recurrent outbreaks. However, there are medications that can reduce the severity and frequency of outbreaks and treatments to manage the symptoms."" "
How do health care providers diagnose genital herpes?,"'In most cases in which the characteristic signs and symptoms are present, they are sufficient to establish a diagnosis of genital herpes infection. Laboratory tests, such as viral culture and nucleic acid amplification (''polymerase chain reaction'' or ''PCR'') tests to detect the genetic material of the virus, are also available.''Immunologic tests to identify antibodies to genital herpes are other possible tests to establish whether infection has occurred.' "
What are medications and treatment options for genital herpes?,"'Antiviral medicines are available that can help manage the severity and duration of outbreaks, if taken immediately prior to (when there are tingling or unusual skin sensations but no blisters) or within 24 hours of a herpes outbreak. The medications typically used are''These are all typically taken by mouth. In severe cases of viral infection, antiviral medications may be given intravenously, but this is not usually needed for herpes. Topical medications that are applied directly to the herpes sores are also available, but these are less effective than oral medications and are not generally used.''All of these medications may also be given daily as suppressive therapy to decrease the number of outbreaks in people who have frequent herpes outbreaks (more than six outbreaks per year).' 

Read Doctor's View
  acyclovir (Zovirax), famciclovir (Famvir), or valacyclovir (Valtrex)."
How do doctors manage genital herpes during pregnancy?,"'Oral antiviral medications as described above may be used during pregnancy. One serious concern with genital herpes in pregnancy is transmission of the infection to the baby during delivery. In an infant, genital herpes infection can spread through the bloodstream and have serious consequences. Cesarean delivery (''C-section'') is performed for women who go into ''labor'' while there is an active outbreak of genital herpes in order to prevent infection of the baby during birth.''The American College of Obstetricians and Gynecologists recommends that pregnant women with recurrent genital herpes be offered oral antiviral medication at or beyond 36 weeks until delivery in order to increase the chances of being able to deliver vaginally.' "
Are home remedies or natural treatments effective for genital herpes?,"'There are no home or natural remedies available for genital herpes, and as mentioned above, the infection cannot be cured. Home cares such as warm baths, keeping the blisters dry after washing, and wearing loose-fitting, cotton underwear may help soothe symptoms.' "
"What is the prognosis for 
a person with genital herpes?","'As discussed previously, there is no cure for genital herpes infection, and the infection persists for life. People vary in the number and severity of outbreaks they experience. For those with frequent outbreaks, taking antiviral medications as suppressive therapy can decrease the frequency of outbreaks.' "
What kind of doctors treat genital herpes?,"'Genital herpes is treated by primary care providers including internal medicine and family medicine specialists, as well as pediatricians for adolescents. For women, gynecologists are often the treating physicians. In certain circumstances, other specialists may be consulted, including urologists and infectious disease specialists.' "
Is there a link between genital herpes and HIV?,"'The ''HIV'' virus that causes ''AIDS'' is not the same as the genital herpes virus. However, having the ulcers and sores of herpes makes it more likely to contract ''HIV'' if exposed, or to transmit ''HIV'' if you have been infected. The ulcers of genital herpes cause breaks in the skin that make spreading the HIV virus to a sex partner more likely during sexual contact.' "
Is it possible to prevent genital herpes?," Herpes can be spread both during an outbreak and by infected people even when there is no outbreak of the condition, so prevention can be difficult. While condoms may help prevent the spread of genital herpes to sexual partners during sexual activity, the infection also can be spread from skin contact in areas not covered by a condom, or during oral to genital contact. If you are having an outbreak, thorough hand washing and not sharing clothing that has touched the herpes sores can also help prevent transmitting the virus to others."
HPV Virus (Genital Warts ) in Men Introduction,"'Much of the information about ''HPV'' virus (human papillomavirus) centers on women, since having the virus increases their risk of getting ''cervical cancer''. But ''HPV'"" virus in men can cause health problems, too. So it's important for men to understand how to reduce the risks of HPV infection.""""It can increase a man's risk of getting genital ""'cancers'', although these cancers are not common. HPV can also cause ''genital warts'' in men, just as in women. ''More than half of men who are sexually active in the United States will have HPV at some time in their life. Often, a man will clear the virus on his own, with no health problems. ' "
Risks of HPV Virus in Men,"'Some of the 30 or so types of HPV associated with genital cancers can lead to ''cancer of the anus'' or penis in men. Both of these ''cancer'' types are rare. In those with a healthy immune system, they are even rarer. About 1,530 men in the U.S. were diagnosed with ''cancer of the penis'' in 2006, according to American ''Cancer'' Society estimates. About 1,910 men got a diagnosis of ''anal cancer''. ''The risk of ''anal cancer'' is about 17 times higher in sexually active gay and bisexual men than in men who have sex only with women. Men who have ''HIV'' (human immunodeficiency virus) are also at higher risk of getting this ''cancer''. ''Other types of HPV virus rarely cause cancer in men, but they do cause ''genital warts''. At a given point in time, about 1% of sexually active men in the U.S. will have genital ''warts''. ' "
Male HPV: The Symptoms,'The types of high-risk HPV that can cause cancer rarely present any symptoms in men or in women. Genital ''warts'' are the first symptom you may see with low-risk HPV ''strains'' that cause warts but not cancer.' 
Tests for HPV Virus in Men,"""To diagnose genital warts in men, the doctor will visually check a man's genital area to see if warts are present. Some doctors will apply a vinegar solution to help identify warts that aren't raised and visible. But the test is not foolproof. Sometimes normal skin is mistakenly identified as a wart. ""'There is no routine test for men to check for high-risk HPV strains that can cause cancer. However, some doctors are urging anal Pap tests for gay and bisexual men, who are at higher risk of anal cancer caused by HPV. In an anal ''Pap test'', the doctor collects cells from the anus, and then has them checked for abnormalities in a lab. ' "
Treatments for HPV,"'There is no treatment for asymptomatic HPV infection. Instead, doctors treat the health problems that are caused by the HPV virus.''When genital warts appear, a variety of treatments can be used. The patient can apply prescription creams at home. Or a doctor can surgically remove or freeze off the warts. ''Early treatment of warts is discouraged by some doctors because genital warts can go away on their own. It can also take time for all warts to appear. So a person who treats warts as soon as they appear may need another treatment later on. ''Anal cancer can be treated with ''radiation'', ''chemotherapy'', and surgery. The specific treatments depend on the stage of cancer - how big the ''tumor'' is and how far the cancer has spread. ' "
HPV Vaccine for Men?,"'The ''HPV vaccine'' ''Gardasil'', approved for use in women in 2006, is not yet approved for men. ''Studies are still being done to determine if the ''vaccine'' works in males. Eventually, public health experts say, boys and men may be vaccinated. ' "
How to Manage HPV in a Relationship,"""If a man's long-term sexual partner has HPV, chances are good HPV transmission has already occurred and he also has it. HPV in men may clear from the body more easily than in women. Women, in general, often clear the virus in two years or less. ""'The HPV types associated with ''cervical cancer'' usually do not cause health problems for a heterosexual man having sex with an HPV-infected woman. ''If a partner has HPV, it does not necessarily mean they have had sex with someone else recently. The virus can lay dormant in the body for years without causing noticeable symptoms. ' "
How to Prevent Transmission of HPV,"'Abstinence is the only sure way to prevent HPV transmission. Risk of transmission can be lowered if a person has sex only with one person who is not infected and who is monogamous. ''To lower the risk of HPV transmission, men can also limit the number of sex partners and pick partners who have had few or no partners in the past. ''Condoms'"" can provide some protection against HPV transmission. But they aren't 100% effective, since HPV is transmitted primarily by skin-to-skin contact. The virus can still infect the skin uncovered by the ""'condom''. ''In a recent study of young women who had just become sexually active, those whose partners used a condom each time they had sex were 70% less likely to get an HPV infection than were women whose partners used a condom less than 5% of the time.''WebMD Medical Reference''SOURCES: Joel Palefsky, MD, professor of medicine, University of California, San Francisco. CDC: ""HPV and Men,"" and ""HPV Vaccine: Questions and Answers."" American Social Health Association: ""HPV: Genital Warts: Questions &amp; Answers,"" and """"What Men Should Know."" Diane Harper, MD, MPH, professor of community and family medicine and obstetrics and gynecology, Dartmouth Medical School, Hanover, N.H. Joan Walker, MD, gynecologic oncologist, University of Oklahoma Health Sciences Center, Oklahoma City. Winer R. New England Journal of Medicine, June 22, 2006: vol 354: pp 2645-2654. ''Reviewed by Louise Chang, MD on April 24, 2007 ''© 2007 WebMD, Inc. All rights reserved.' "
