Questions,Answer
Monitoring osteoporosis therapy,"'The American Medical Association and other reputable medical organizations recommend that repeat bone density testing (DXA scans) ''not'' be done for monitoring osteoporosis treatment or prevention on a routine basis. It is sometimes difficult to know just how to use repeated bone density measurements during therapy. Here are a few of the most important reasons:''For all of these reasons, as surprising as it may sound to many people (and even some doctors!), rechecking bone density is not at all like checking ''blood pressure'' during treatment of ''high blood pressure'' (''hypertension''). Routine bone density testing during treatment may not be helpful. In the future, however, if ongoing research brings new technology or new therapies, testing decisions may change.' Bone density changes so slowly with treatment that the changes are smaller than the measurement error of the machine. In other words, repeat DXA scans cannot distinguish between a real increase in bone density due to treatment and a mere variation in measurement from the machine itself. The real purpose of osteoporosis treatment is to decrease future bone fractures. There is no good correlation between increases in bone density with decreases in fracture risks with treatment. For example, alendronate has been shown to decrease fracture risk by 50% but only to increase bone density by a few percent. In fact, most of the fracture reduction with raloxifene is not explained by raloxifene's effects on bone mineral density. One density measurement taken during treatment will not help the doctor plan or modify treatment. For example, even if the DXA scan shows continued deterioration in bone density during treatment, there is not yet research data demonstrating that changing a medication, combining medications, or doubling medication doses will be safe and helpful in decreasing the future risk of fractures. Even if bone density deteriorates during treatment, it is quite likely that the patient would have lost even more bone density without treatment. Recent research has shown that women who lose bone density after the first year of HRT will gain bone density in the next two years of therapy, whereas women who gain in the first year will tend to lose density in the next two years of therapy. Therefore, bone density during treatment fluctuates naturally, and these fluctuations may not correlate with the prevention of fractures due to the medication."
Prevention of hip fractures in elderly people with osteoporosis,"'Elderly people with osteoporosis can decrease their risk for hip fracture by maintaining muscle strength, coordination, and balance with exercise programs. Throw rugs and animals in pathways of the home should be minimized or eliminated. Good lighting is essential for safe walking to the restroom both day and night.''Additionally, for those elderly people who use canes for walking, etc., it is essential that the rubber tips of the canes are regularly checked for any signs of wear. When this rubber wears through it presents a serious risk of causing the cane (and, therefore, the person) to slip, which can result in serious bodily ''harm -- including'' hip fracture.''Currently, it is not clear as to how long patients with osteoporosis being treated with bisphosphonates should continue the bisphosphonate treatment. Many doctors are interrupting treatment for a ""drug holiday"" off of the drug as it may not be necessary after five to seven years. Guidelines for duration of treatment of osteoporosis with bisphosphonates are being developed.' "
What are complications of osteoporosis?,"'The primary complication of osteoporosis is bone fracture. This may lead to no symptoms or be associated with severe, intractable pain. Recurrent fractures are common and can lead to deteriorating skeletal structure. Occasionally, fractures of the spinal vertebrae can push bone into adjacent nerves and/or spinal cord. This can require neurosurgical intervention. Osteoporotic vertebral fractures can also be relieved by vertebroplasty (kyphoplasty) procedures whereby the collapsed vertebra is inflated by a balloon and a cement (methylmethacrylate) is injected to reform structure to the vertebra.''Repeated vertebral compression fractures can lead to severe deformity of the spine of the chest (''kyphosis'') that can compromise ''breathing'' along with cause extreme loss of height. This can increase the risk of problems with any respiratory infections.'  "
What is the prognosis (outlook) for patients with osteoporosis?,"'The outlook for patients with osteoporosis depends greatly on where fractures occur. Additionally, if treatment is begun when the bone disease is detected early, the outcome is better.''Hip fractures are a particularly dangerous consequence of osteoporosis in the elderly. Approximately 20% of those who experience a hip fracture will die in the year following the fracture. Only one-third of hip-fracture patients regain their pre-fracture level of function. One-third of hip-fracture patients are discharged to a nursing home within the year after fracture.''Newer medications, medicine with different methods of delivery, and research into the optimal management of osteoporosis will bring even better options for health care of patients with osteoporosis in the future. Persons interested in more information about osteoporosis and its treatment options can get information from the National Osteoporosis Foundation.' "
What Is the Goal of Physical Therapy?,"'The goal of physical therapy is to get a person back to the point where he or she can perform normal, everyday activities without difficulty. ''Preserving good range of motion is key to maintain the ability to perform daily activities. Therefore, increasing the range of motion of a joint is the primary focus of physical therapy. Building strength in the involved muscles surrounding the joint also is extremely important, since stronger muscles can better stabilize a weakened joint. ''Physical therapists provide exercises designed to preserve the strength and use of your joints. They can show you the best way to move from one position to another and can also teach you how to use ''walking'' aids such as crutches, a walker or a cane, if necessary. ' "
What Are Some Benefits of Occupational and Physical Therapy?,"'If you have arthritis, there are many benefits to participating in a physical and occupational therapy program, including: ' You gain education about your type of arthritis, so that you can be well 
	informed. If you are overweight, a dietary plan can be created to reduce the 
	stress of excess weight on supporting joints of the back, legs, and feet. As 
	yet, no specific diet -- other than a diet designed for weight loss -- has 
	proved helpful for arthritis. You gain foot-care advice, including choice of well-fitting shoes with 
	shock-absorbing outer soles and sculptured (orthotic) insoles molded exactly 
	to the contour of each foot. You will learn therapeutic methods to relieve discomfort and improve 
	performance through various physical techniques and activity modifications."
What Techniques Will I Learn?,"""You'll learn several techniques, including:"" Rest. Bed rest helps reduce both joint inflammation and pain, and is especially useful when multiple joints are affected and fatigue is a major problem. Individual joint rest is most helpful when arthritis involves one or only a few joints. Custom splints can be made to rest and support inflamed joints and a soft collar can support the neck while you are sitting or standing. Thermal modalities. Applying ice packs or heating pads, as well as deep heat provided by ultrasound and hot packs, can help relieve local pain. Heat also relaxes muscle spasm around inflamed joints. Heating joints and muscles with a warm bath or shower before exercising may help you exercise more easily. Exercise. Exercise is an important part of arthritis treatment that is most effective when done properly every day. Your doctor and therapist will prescribe a program for you that may vary as your needs change."
What Therapy Is Offered for People Recovering From Joint Replacement?,"'Preoperative programs of education and exercise, started before joint replacement surgery, are continued at home. They may be changed in the hospital after surgery to fit new needs during the rehabilitation period. These exercises may be added to your usual exercise regimen, and you may find your ability to exercise has improved after surgery.' "
What Joint Protection Techniques Are Offered?,"'There are ways to reduce the ''stress'' on joints affected by arthritis while participating in daily activities. Some of these include: ''An occupational therapist can show you ways to do everyday tasks without worsening pain or causing joint damage. Some joint protection techniques include: ' Controlling your weight to avoid putting extra stress on weight-bearing 
	joints such as the back, hips, knees, and feet. Being aware of body position, using good posture to protect your back 
	and the joints of your legs and feet. When possible, sit down to do a job 
	instead of standing. Change position often since staying in one position for 
	a long time tends to increase stiffness and pain. Conserving energy by allowing for rest periods, both during the workday 
	and during an activity. Respecting pain. It is your body's way of telling you something is 
	wrong. Don't try an activity that puts strain on joints that are already 
	painful or stiff. Using proper body mechanics for getting in and out of a car, chair or 
	tub, as well as for lifting objects. Using your strongest joints and muscles to reduce the stress on smaller 
	joints. For example, carrying a purse or briefcase with a shoulder strap 
	rather than with your hand. Distributing pressure to minimize stress on any one joint. Lifting 
	dishes with both palms rather than with your fingers and carrying heavy 
	loads in your arms instead of with your hands. If your hands are affected by arthritis, avoid tight gripping, pinching, 
	squeezing, and twisting. Ways to accomplish the same tasks with alternate 
	methods or tools can usually be found."
What Are Assistive Devices for Arthritis?,"'If you have arthritis, many assistive devices have been developed to make activities easier and less stressful for the joints and muscles. Your therapist can suggest devices that will be helpful for tasks you may find difficult at home or at work.''A few examples of helpful devices include a bath ''stool'' for use in the shower or tub, grab bars around the toilet or tub, and long-handled shoehorns or sock grippers. Your therapist can show you catalogs that have a wide variety of assistive devices.''WebMD Medical Reference' "
What is middle ear infection or inflammation?,"'Middle ear inflammation is also called otitis media. Otitis media is inflammation of the middle ear; however, many doctors consider otitis media to be either inflammation or infection of the middle ear, the area inside the eardrum (tympanic membrane -- see illustration). ""Otitis"" means inflammation of the ear, and ""media"" means middle. This inflammation often begins with infections that cause sore throats, colds, or other respiratory problems, and spreads to the middle ear. Infections can be caused by ''viruses'' or bacteria, and can be acute or chronic. Both ears can be infected at the same time (double ''ear infection''). These infections are not ""swimmer\'s ear"" (also termed ''otitis externa'' or outer ''ear infection'"" because it occurs in the ear canal up to the eardrum), but not beyond. However, some people can have swimmer's ear and a middle ear infection at the same time.""'Acute middle ear infections ''usually are of rapid onset and short duration. They typically are associated with fluid accumulation in the middle ear, signs or symptoms of infections in the ear, a bulging eardrum usually accompanied by pain or a ''perforated eardrum'', and drainage of purulent material (pus, also termed suppurative otitis media). The person also may have a ''fever''.''Chronic middle ear infections'' are a persistent inflammation of the middle ear, typically for a minimum of three months. This is in distinction to an acute ear infection that usually lasts only several weeks. Following an acute infection, fluid (an effusion) may remain behind the eardrum (tympanic membrane) for up to three months before resolving. It may develop after a prolonged period of time with fluid (effusion) or negative pressure behind the eardrum (tympanic membrane). This type of infection can cause ongoing damage to the middle ear and eardrum, and there may be continuing drainage through a hole in the eardrum. Chronic middle ear infections often start painlessly without fever. Ear pressure or popping can be persistent for months. Sometimes a subtle loss of ''hearing'' can result from chronic middle ear infections.' "
What is serious middle ear infection or inflammation?," Serious otitis media is inflammation in the middle ear without infection. Typically, the Eustachian tube is not functioning and cannot ventilate the ear normally. As a result, fluid accumulates in the middle ear. This can lead to a dullness or fullness within the ear along with diminished hearing."
What happens to the eardrum in chronic middle ear infection or inflammation?," The eardrum (tympanic membrane) has three delicate layers that help keep the eardrum thin but strong. A chronic middle ear infection causes changes in the eardrum that weaken it, and often lead to a hole in the eardrum (tympanic membrane perforation). Eventually, the eardrum loses its strength and begins to collapse into the middle ear space. When the eardrum collapses or retracts from negative pressure in the middle ear, it can attach to the other middle ear structures. The eardrum is frequently seen draped around the middle ear bones (ossicles) or the inner wall of the middle ear (promontory). This disrupts the conduction of sound through the middle ear and may diminish hearing."
What happens to the eardrum if a hole develops in the eardrum?,"  A hole that forms in the eardrum (tympanic membrane perforation) usually causes a chronic draining ear, or a condition called chronic otitis media with perforation. Often the drainage (otorrhea) will have a foul odor and can be seen draining from the ear. Hearing can improve after the middle ear fluid is released, or it may worsen secondary to the inflammation in the middle ear."
How common is acute middle ear infection or inflammation?," This type of acute middle ear infection is an extremely common diagnosis. In the U.S., it is estimated that most children experience at least one middle ear infection before the age of three."
Why do infants and young children tend to have ear infections?," The Eustachian tube, a canal that runs from the middle ear to the back of the nose and throat, is shorter and more horizontal in infants and young children than in older children and adults. This allows easier entry into the middle ear for the microorganisms that cause infection and leads to otitis media. Young children also have more immature immune systems. The result is that infants and young children are at greater risk of acquiring ear infections than adults."
How does the Eustachian tube change with age?," As a person ages, the Eustachian tube doubles in length and becomes more vertically positioned so that the nasopharyngeal orifice (opening) in the adult is significantly below the tympanic orifice (the opening in the middle ear near the ear drum) than in a child. The greater length and particularly the slope of the tube as it grows serves more effectively to protect, aerate and drain the middle ear."
How do you get a middle ear infection?," Bacteria and viruses can cause middle ear infections. Bacteria such as Streptococcus pneumoniae (pneumococcus), Hemophilus influenzae, Pseudomonas, and Moraxella account for about 85% of cases of acute otitis media. Viruses account for the remaining 15%. Affected infants under 6 weeks of age tend to have infections from a variety of different bacteria in the middle ear."
Common causes of acute and middle ear infection?," Bottle-feeding: The position of the breastfeeding child is better than that of the bottle-feeding position in terms of the function of the Eustachian tube that leads into the middle ear. If an infant needs to be bottle-fed, it's better to hold babies rather than allowing them to lie down with the bottle. Ideally, they should not take the bottle to bed. (In addition to increasing the chance for acute infection, falling asleep with milk in the mouth enhances the risk of tooth decay.) Upper respiratory tract infection: Children often develop upper respiratory infections prior to developing this type of infection. Exposure to groups of children (as in childcare centers) results in more frequent colds, and therefore more earaches. Exposure to air with irritants, such as tobacco smoke Birth defects: Children with cleft palate or Down syndrome are more prone to ear infections. Eustachian tube problems: Any problems with the Eustachian tubes (for example, blockage, malformation, inflammation) will increase the risk of infection. If the individual has allergies, he or she may have swelling and blockage of one or both Eustachian tubes. Immunosuppressed: Individuals with suppressed immune response are at increased risk for ear infections. Ear infections later in childhood: Children who have episodes of acute infections before six months of age tend to have more later in childhood."
What causes chronic middle ear infection or inflammation?," The Eustachian tube normally prevents the accumulation of fluid by allowing fluid to drain through the tube. Chronic otitis media develops over time, and often starts with a chronic middle ear effusion (fluid) that does not resolve. This persistent fluid will often become contaminated with bacteria, and the bacteria found in chronic otitis media are often different from those found in acute otitis media. Therefore, anything that disturbs the function of the Eustachian tube can lead to chronic otitis media. In some individuals that are ill from other diseases, and there is pus draining from the ear, there is a danger that otitis media (especially bacterial-caused) may invade the mastoid bone and reach the brain. These individuals need to be seen urgently by a health care professional. Do not delay treatment by trying home remedies."
"Signs and symptoms of acute middle ear infection in infants, toddlers, and children","'Signs and symptoms of middle ear infections in babies, toddlers, and children may include the following:''These symptoms are often associated with signs of ''upper respiratory infection'' such as a runny or stuffy nose, or a ''cough''.'   Young nonverbal children may be irritable and pull or tug at their ear(s). Young children with middle ear infections may be irritable, fussy, or have problems feeding or sleeping. Older children may complain about pain and fullness in the ear (earache). A child of any age may have a fever. The buildup of pus within the middle ear causes pain and dampens the vibrations of the eardrum (so there is usually temporary hearing loss during the infection). Severe ear infections may cause the eardrum to rupture. The pus then drains from the middle ear into the ear canal. The hole in the eardrum from the rupture usually heals without medical treatment."
Signs and symptoms of middle ear infections in adults, Ear pain Difficulty hearing Ear(s) may feel plugged up Ringing in ears Dizziness Fever Headache Nausea and/or vomiting
Are ear infections contagious?," Ear infections are not contagious. However, many children develop infections following a cold or other viral infection, and those infections are contagious."
Which specialties of doctors treat middle ear infections?," The majority of children and adults are diagnosed and treated by either pediatricians, primary health care doctors, emergency or urgent care medical providers, or other health care professionals. Ear, nose, and throat (ENT) specialists may be consulted for some individuals. On rare occasions, a neurologist or neurosurgeon may be needed to treat a severe infection that may extend to other organ systems."
How is acute middle ear infection diagnosed?,"'The American Academy of ''Pediatrics'' (AAP) and the American Academy of Family Physicians (AAFP) have determined the criteria needed to diagnose acute otitis media (AOM), acute onset, middle ear effusion (MEE), and middle ear inflammation.''Identification of the three criteria is dependent on clinical observation; middle ear effusion and middle ear inflammation are the most difficult to observe and as a consequence there are studies that suggest acute otitis media is overdiagnosed.' The new guidelines describe this as ""moderate to severe bulging of the tympanic membrane (ear drum) or new onset of otorrhea (ear drainage) not due to external otitis (inflammation of the ear canal) or mild bulging of the ear drum, and recent ear pain (holding, tugging, rubbing ear in a nonverbal child) or intense reddening of the ear drum."" The guideline also strongly recommends that clinicians should not diagnose AOM without the presence of MEE. Recurrent acute otitis media is defined as at least three well-documented and separate acute otitis media episodes in 6 months or four well-documented and separate AOM episodes in the past 12 months with at least one in the past 6 months. There is no definitive lab test for acute otitis media. One method that helps determine acute otitis media versus otitis media with effusion is pneumatic otoscopy (the normal eardrum moves readily with pressure changes) and the appearance of the tympanic membrane (acute otitis media has abnormal appearance; otitis media with effusion does not). However, not everyone is skilled at this technique; pediatricians, family practice physicians, ENT specialists, and ER doctors who work in pediatric ER's are likely to be skilled in the diagnostic procedure."
How is acute middle ear infection or inflammation treated?,"'The treatment for acute otitis media varies depending upon the age and symptoms of the child. The American Academy of Pediatrics (AAP) and the American Academy of Family Physicians (AAFP) recommend the following:''*Observation is an appropriate option only when follow-up can be ensured and antibacterial agents can be started if symptoms persist or worsen within 2-3 days. The guidelines also recommend ""shared decision making"" with the ''caregiver''. Non-severe illness is represented by mild ear pain and fever <39 C (102.2 F) in the past 24 hours. Severe illness is defined as moderate to severe otalgia (ear pain) or any ear pain for at least 48 hours or fever 39 C. These 2013 guidelines are current.''If antibiotics are initiated, ''amoxicillin'' is usually recommended as the first line treatment. This is usually prescribed for 10 days. Some children do not respond within the first 48-72 hours of treatment, and antibiotic therapy may have to be changed. Even after antibiotic treatment, some children are left with some fluid in the middle ear, which can cause temporary hearing loss lasting for up to 3 to 6 weeks. In most children, this fluid eventually disappears spontaneously (on its own). Ceftriaxone (50mg/kg/d) injection is recommended for children who cannot take oral antibiotics; three days of this antibiotic is usually more effective than a single injection.''Children who have recurring bouts of otitis media may be referred to an otolaryngologist (ear, nose, and throat specialist or ENT). Some of these children may benefit from having an ear tube placed (tympanostomy tube) to permit fluid to drain from the middle ear. In addition, if a child has a bulging eardrum and is experiencing severe pain, a procedure to lance the eardrum (myringotomy) may be recommended to release the pus. The eardrum usually heals within a week. Prophylactic antibiotic therapy has not been shown to decrease the frequency of ear infections in those children with recurrent AOM.''Although treatment may cure an ear infection, it is possible for the ear to become re-infected.'  "
How is chronic middle ear infection or inflammation treated?," Initially, antibiotics may resolve the ear infection. If a tympanic membrane perforation also is present, topical antibiotic drops may be used. If eardrum or ossicle scarring has occurred, that will not be reversed with antibiotics alone. Surgery often is indicated to repair the tympanic membrane (eardrum) and remove the infected tissue and scar from the middle ear and the mastoid bone. Long-term prophylactic antibiotics are not recommended."
What are the goals of chronic otitis media surgery?,"'Finally, hearing is to be restored.'   The goals of surgery are to first remove all of the infected tissue so that it can be ""safe"" from recurrent infections. The second goal is to recreate a middle ear space with an intact eardrum. This may seem strange that hearing is the last priority, but if the first two priorities are not met, anything that is done to improve hearing will ultimately fail. If hearing is restored, but the infection returns, the hearing will be lost again. Likewise, if hearing is restored, but the middle ear space is not recreated, the eardrum will re-stick to the middle ear or the ossicles."
