Questions,Answer
Facts you should know about onchocerciasis," Onchocerciasis is a parasitic disease that may cause blindness. It occurs mainly in sub-Saharan Africa and a few isolated areas in the Americas (Brazil, Colombia, Guatemala, Mexico, and Venezuela) and is transmitted by blackfly bites. It is called river blindness as the blackfly that transmits the disease lives and breeds near fast-flowing rivers. Symptoms include skin changes, itching, nodules, and alterations in vision. Symptoms may not appear for months to years. Onchocerciasis is diagnosed by finding the parasites in skin nodules, skin biopsies, or skin scrapings. The treatment is the antiparasite drug ivermectin, given once or twice a year for about 10-15 years; the antibiotic doxycycline may also be utilized. The major risk factor for onchocerciasis is residing or having extended visit time in areas where blackflies are endemic. There are no vaccines or drugs that prevent onchocerciasis. Avoiding areas where blackflies are endemic and the use of personal protection items (clothing, insect repellents) reduce the chance of infection. The earlier that onchocerciasis is diagnosed and treated, usually the better is the prognosis."
What is onchocerciasis?,"'Onchocerciasis is a parasitic disease caused by parasites (nematode) named ''Onchocerca volvulus''. It is transmitted to humans by the bite (blood meal) of the female blackfly (''Simulium''). The disease is also termed river blindness because the vector, the blackfly, is usually found breeding close to rapidly flowing streams and rivers, and because the most devastating manifestation of the infection is blindness. Although the majority of people infected reside in sub-Saharan Africa (for example, Nigeria), it also occurs in Central and South American countries and Yemen but much less frequently. After ''trachoma'', it is the second-leading cause of infection-caused blindness worldwide. The CDC classifies it in the Neglected Tropical Diseases category: a group of parasitic and bacterial disease that cause substantial illness in more than 1 billion patients.' "
What causes onchocerciasis?,"'The cause of onchocerciasis is the transfer of larvae of the parasite ''Onchocerca volvulus'' by the female blackfly when the fly gets a blood meal (bites) a human. The larvae enter the subcutaneous tissues and develop into adult male and female worms (filarial nematodes). These reproduce in the human tissue and form microfilariae that migrate to other areas of connective tissue and occasionally to the blood, urine, and sputum. In addition, both the adult worms and the microfilaria are colonized with bacteria termed ''Wolbachia'' that help these parasites survive. When the worms die, a host immune response ensues that can destroy optical tissue in the eye. The life cycle of the parasites is continued when a blackfly bites a human and, during its blood meal, ingests microfilariae. The complex life cycle is shown below.' "
What are risk factors for onchocerciasis?,"'Living in and visiting sub-Sahara Africa and the few other areas where the blackfly is endemic is a major risk factor for developing onchocerciasis. The disease usually occurs after repeated exposures to blackfly bites so short-term ''travelers'' through these areas pose little risk; however, missionaries, volunteer health workers, and others who may spend a few months in the areas have an increased risk of infection.' "
Is onchocerciasis contagious?,'Onchocerciasis is not ''contagious'' person to person. Transmission of the disease is through the bite of female blackflies (usually occurring during the daytime near rapidly flowing rivers and streams). Multiple bites are usually needed before being infected.' 
What are onchocerciasis symptoms and signs?,"'The symptoms and signs of onchocerciasis are as follows:'   Skin inflammation that is very itchy and forms papules on the skin Nodules in the skin (subcutaneous nodules or bumps) Scarred, saggy, or drooping areas of skin Patchy skin depigmentation (leopard skin) Lymph node inflammation (lymphadenitis) Eye (ocular) lesions (eye itching, redness, or swelling) Visual problems (visual impairment and/or inability to distinguish certain colors, partial or complete blindness) Eosinophilia (unusually high levels of eosinophils in the blood) ""Sowda"" is a term used to describe the severe itching and skin discoloration (darkening), that is often confined to one limb, that can be found with onchocerciasis."
Is there an incubation period for onchocerciasis?,"'Although the infection with larvae begins immediately, the disease may not become apparent in an individual for months to years. In most individuals, it develops slowly in the skin although some patients may present initially with ''eye problems''.' "
What types of specialists treat onchocerciasis?,"""Although local clinic doctors, who are often the patient's primary-care provider, usually treat onchocerciasis, specialists may be consulted. Such specialists are infectious-disease, ophthalmologist, dermatologists, and travel-medicine doctors. These specialists can help diagnose and treat patients with onchocerciasis."" "
How do health care professionals diagnose onchocerciasis?,"'Clinical presumptive diagnosis is made if the patient lives or visits areas where the disease is endemic and has characteristic skin or eye changes described above. Definitive diagnosis is simply done by seeing adult worms in excised skin nodules, eye lesions, or by finding microfilariae in skin shavings or punch biopsies of the skin. In addition, an immunological test for antibodies developed against the parasites early in the infection is useful to determine if a person is infected before microfilariae are detectable. This test is available from the CDC. It is important to obtain a definitive diagnosis so that appropriate treatment can be started (see treatment section below). Onchocerciasis is a type of filariasis that does not respond well to some other ''drugs'' used to treat other similar filarial diseases. Diethylcarbamazine, a commonly used drug that is a derivative of piperazine, actually has been linked to severe and sometimes fatal patient reactions when used to treat onchocerciasis.' "
What is the treatment for onchocerciasis?,"'Treatment is done by giving the patient ''ivermectin'', an antiparasitic drug once or twice per year for about 10-15 years (the life span of adult worms). This antiparasite drug is effective in killing the microfilariae but does not kill the adult worms. The mature worms may remain alive for 10-15 years in the patient. Most clinicians recommend that subcutaneous nodules should be excised, if possible, thereby removing the adult worms that may reproduce more microfilariae over time. Some clinicians recommend that after ivermectin treatment, patients may benefit from a six-week dose of ''doxycycline'' antibiotic. Doxycycline damages and kills ''Wolbachia'' bacteria that are inside the microfilariae and adult worms, resulting in the death of microfilariae and ineffective microfilariae produced by the surviving adult worms. This may slow or halt further disease development.''The use of diethylcarbamazine (a treatment used before ivermectin became available) is contraindicated. It may cause severe or fatal patient reactions in individuals with onchocerciasis.'""A new drug capable of killing the adult worms of onchocerciasis is under study for use in humans. It's named moxidectin but has not yet been approved for use in humans for treatment of onchocerciasis."" "
Is it possible to prevent onchocerciasis?,"'Currently, there is no drug or ''vaccine'' available that prevents onchocerciasis. However, preventing blackfly bites by avoiding areas where they are endemic can prevent infections. Other measures such as personal protection against blackfly bites and other biting insects (for example, insect repellent, pants tucked in boots, long-sleeved shirts) may reduce the chances of infection. ''Permethrin'', an insect repellent, can be impregnated into cloth (shirts, pants, netting) and offers additional protection against blackfly bites' "
"What is the prognosis 
and possible complications of onchocerciasis?","'The prognosis (outcome) depends on how quickly the infection is recognized and treated. The prognosis is good if the disease is adequately treated and the patient makes their follow-up appointments and treatments. However, if the diagnosis and treatment is accomplished late in the disease, the prognosis may be fair to poor because the patient may develop complications of significant skin alterations, visual problems, or complete blindness.' "
What are ingrown toenails?,"'An ingrown toenail (onychocryptosis) is caused by the pressure from the ingrowth of the nail edge into the skin of the toe. Once the edge of the nail breaks through the skin, it produces inflammation. Initially presenting as a minor discomfort, it may progress into an infection in the adjacent skin (''cellulitis'') and/or become a reoccurring problem. Ingrown toenails most commonly affect the large (great) toes.'  "
What causes ingrown toenails?,"'An imbalance between the size of the nail and the enlargement of the nail skin edge causes ingrown toenails. This condition can be exacerbated by improper trimming of the toenail, an ''inherited'"" or hereditary condition, and improper shoe fitting. Injury by overly aggressive pedicures and nail picking are also common causes. Some people's toenails naturally curl inward (known as pincer nails). These toenails can easily become painful. Adolescents and athletes perspire more often. This causes nails and skin to be soft. The thin nail can eventually split and pierce the softened skin.""  "
Are some people more prone to ingrown toenails?,"'There are a number of risk factors that may predispose a person to having an ingrown toenail. The following are some of the more common:' Athletics, particularly stop and start sports such as tennis, soccer, and basketball Improper shoe gear that is either too small or too large Repetitive pressure or trauma to the feet Poor foot hygiene Abnormal gait and poor foot mechanics such as pronation Foot or toe deformities, such as bunions, hammertoes, and flat foot Congenital toenail deformity Abnormally long toes Obesity Diabetes Heart, kidney, and thyroid problems, which may cause foot and leg swelling Fungus infection of the nails (onychomycosis) Arthritis Bony or soft-tissue tumors of the toes Hyperhidrosis (excessive sweating of the feet) Edema of the lower extremities"
Which nails are most commonly affected by ingrown toenails?,"'Ingrown toenails most commonly occur in the large or ""great toes."" Those great toes that are shorter than the second toes are even more prone to ingrown toenails. However, any of the toenails can be affected on either border or side.' "
What causes infections in ingrown toenails?,"'The warm, moist environment of the feet can be a breeding ground for bacteria and fungi. These commonly include ''Staphylococcus'', ''Pseudomonas'', dermatophytes, ''Candida'', and ''Trichophyton''. When there is a break in the skin from the offending nail border, these organisms can invade the area and cause an infection. Treatment for these infections is essential to maintain healthy toenails and feet. The medical term for infected ingrown toenail is called ''paronychia''. If not treated, the infected toenail can cause serious problems such as ''chronic pain'' and disfigurement, cellulitis, and bone infection.' "
What are ingrown toenail symptoms and signs?,"'Ingrown toenail symptoms and signs include redness, ''pain'', and swelling. Sometimes there may be a clear yellowish drainage, or if it becomes infected, ''pus drainage''. Young children may show signs of ''limping'' in order to avoid putting pressure at the ingrown toenail site. Occasionally, ingrown toenails resolve without treatment. A podiatrist should treat painful, persistent, and recurring ingrown toenails. If the ingrown toenail has been present for a long time, a very vascular tissue called granulation tissue may form that easily bleeds.' "
How do physicians diagnose an ingrown toenail?,"'The diagnosis of an ingrown toenail is typically straightforward and does not require diagnostic labs or images. However, the signs and symptoms of ingrown toenails can vary quite dramatically, particularly if an infection develops. There may simply be some tenderness at the nail border when pressure is applied. There is typically an incurvation of the nail or a spike of nail (spicule) pressing into the skin of the nail border. Associated redness and swelling localized to the nail also suggest the diagnosis of an ingrown toenail. When an infection is involved, there may be severe redness and swelling, drainage, pus, and malodor.''Making the proper diagnosis requires taking into account the medical history and all possible causative factors. If one is unsure, seek professional help. Some conditions such as tumors, foreign bodies, trauma, and fungal infection may appear to be an ingrown toenail to the untrained eye.' "
What are possible complications of ingrown toenails?,"'A persisting ingrown toenail can have serious consequences. A localized infection of the nail border (paronychia) can progress to a deeper soft-tissue infection (cellulitis), which can in turn progress to a bone infection (''osteomyelitis''). Complications can include scarring of the surrounding skin and nail borders (nail fold hypertrophy) as well as thickened, deformed (onychodystrophy) fungal toenails (''onychomycosis''). Sometimes, there is an enlargement of soft tissue at the nail fold that easily bleeds and drains.' "
Are there any home remedies for an ingrown toenail?,"'The following home remedies may provide temporary relief.''If symptoms persist, seek medical treatment from a podiatrist.'   Lukewarm water foot soaks for 15-20 minutes with any one of the following options can be helpful: one part white vinegar to four parts water; 2 tablespoons Epsom salts per quart of water; or a dilute Clorox type bleach with 1/3 teaspoon of Clorox in 1 gallon of water. Gently massage the affected skin area downward while soaking. Elevate the foot and leg. Take oral anti-inflammatory medications. Apply antibacterial ointments on the affected side of the nail. Trim the toenail straight across the top without digging into the corners or leaving them too short. Carefully rolling back the overgrown skin at the affected nail border may allow you to slip a small piece of cotton or dental floss to lift the offending edge of the nail up from the skin. Wait for the nail to outgrow while attempting any one of the above methods."
When should someone seek medical treatment for an ingrown toenail?,"'People with ''diabetes'' or those who have a compromised immune system or poor circulation should promptly seek the care of a podiatrist/physician for ingrown toenail treatment even if the symptoms appear mild. If home remedies are not successful within a week or there is persistent ''pain'' and/or signs of infection, seek podiatric medical treatment. Symptoms and signs of infection can include:' Swelling Redness Streaking (redness spreading from the toe to middle of the foot) Pain Malodor Drainage that may be yellow, green, or white and purulent (containing pus)"
What kind of doctor treats ingrown toenails?,"""Although many types of doctors, including family physicians, pediatricians, urgent-care walk-in physicians, and dermatologists, can treat ingrown toenails, podiatrists (foot and ankle specialty doctors) are uniquely qualified among the medical professionals to treat this condition. A podiatrist's office is also equipped with necessary instruments required to perform ingrown toenail procedures."" "
What is the treatment for ingrown toenails?,"'There are various types of treatments, including self-care, soaking, avoidance of shoe pressure on the toenails, proper methods to trim the nails, and various surgical treatments. Sometimes antibiotics may be required.' "
What types of nail surgery are used for ingrown toenails?,"'Surgical treatments include the following: temporary resection and removal of the offending nail border or corner, avulsion (detachment) of the nail or offending nail border, or permanent elimination of the nail (matrixectomy) or offending nail border (partial matrixectomy). A matrixectomy is the destruction or removal of the cells where the nail grows from called the nail matrix. The nail matrix is at the base of the toenail under the skin. This procedure can be done surgically by dissection, chemically, or electrically by destroying part or all of the matrix cells. These procedures are commonly reserved for chronic or recurrent situations.'  "
Do surgical procedures that treat ingrown toenails require anesthesia?,"'Simple resection and removal of the offending nail edge often does not require anesthesia. However, nail avulsion and matrixectomy does require local anesthesia. The anesthesia is injected directly into the toe and its effect lasts throughout the procedure. Because the anesthesia is administered locally, there is a minimal effect on driving or ''walking'' after the procedure.' "
What does the recovery from toenail surgery entail?,"'The operated foot should be elevated for the remainder of the day. Typically, the dressings are removed the day following the procedure. Cleansing of the ''wound'' or soaks in Epsom salts and/or antimicrobial soap followed by application of an antibacterial cream and small bandage (Band-Aid) twice a day for one to two weeks can help to prevent infection. Open toe or loose-fitting, wide toe box shoes are recommended to avoid pressure to the toe while healing. Your doctor may want to see you return in a few weeks to ensure appropriate healing of the procedure site.' "
What is the appearance of the nail after surgery?,"'If a permanent resection of the nail was performed (matrixectomy), the nail will appear narrower by a few millimeters on the affected nail border. Unless a large portion of the nail was removed during the procedure, the overall appearance of the nail does not change significantly. If the nail matrix is not removed or cauterized, then the nail should regrow to its original appearance and width.'""If conservative treatments fail, surgery to remove the offending nail border is recommended. If the condition is recurrent and/or chronic, a matrixectomy may be recommended. Both procedures (removal of offending nail and matrixectomy) are usually performed in your doctor or podiatrist's office."" "
What are the potential complications of surgery?,"'Complications from ingrown toenail surgeries are rare but can occur. Complications include infection after the procedure, prolonged tenderness along the procedure site, a slow-healing wound (especially in those with ''diabetes''), and recurrence. You are more prone to post-surgery complications if you do not follow proper instruction to care for the ingrown toenail. Fortunately, these complications are fairly easy to manage. If you are prone to infection, your doctor may prescribe oral antibiotics following the procedure.' "
How can people prevent ingrown toenails from recurring?,"'Avoid shoes that are too small (putting pressure on the toenail) or too large (where the foot is moving back-and-forth inside the shoe). Improperly fitting footwear can cause trauma to the toenail. Sometimes the best shoes for symptomatic ingrown toenails are those without a closed toe box. Use proper methods of trimming the toenail with clean instruments, cut straight across toenails, and do not trim them too short. Wear corrective orthotic devices if you have faulty foot mechanics that result in excessive pressure at the nail fold.'  "
Ingrown toenail do's, Do wear properly fitting shoes that allow you to wiggle your toes without having your foot slide around within. Do avoid repeated pressure and trauma to the toenails. Do wear sport-specific shoes. Do practice good foot hygiene. Do trim toenails straight across.
Ingrown toenail don'ts, Don't cut down the corners of the toenails. Don't trim toenails too short. Don't wear improperly fitting shoes. Don't avoid treatment by a professional if symptoms persist. Don't do surgery on the toenail yourself.
What is the prognosis for an ingrown toenail?,"'The prognosis for an ingrown toenail is generally very good, particularly if you seek professional treatment when the problem does not resolve itself after a week or so and a medical professional addresses risk factors.' "
"Facts you should know about fungal nails (onychomycosis, tinea unguium)","'Many changes in fingernails or toenails may cause people to think they have a fungal infection of the nails, medically known as ''onychomycosis'' or ''tinea unguium''.''Fungal infection of the nails sometimes makes the condition sound ''contagious'' or related to ''poor hygiene''. In fact, up to 10% of all adults in Western countries have fungal infection of the nails. This percentage increases to 20% of adults who are age 60 or older. ''Toenail fungus'' is much more common than fingernail fungus.''In reality, abnormal-looking nails may be caused by a number of conditions including, but not limited to, fungal infection. There are many other reasons why your nails may look different.' "
What other conditions can be mistaken for fungal nails?,"'Here are some other conditions you may have instead of ''fungal nails'':' Lines and ridges: These are common and may be considered normal. They may worsen during pregnancy. A large groove down the center of the nail can be caused by nail biting. Some people may develop these changes following chemotherapy. Senile nails: As you age, the nails become brittle and develop ridges and separation of the nail layers at the end of the nail. To avoid this, try to clean solutions and don't soak the nails in water. Whitish or yellowish nails can occur due to onycholysis. This means separation of the nail from the nail bed. The color you see is air beneath the nail. The treatment is to trim the nail short, don't clean under it, polish if you want to hide the color, and wait two to three months. Persistent onycholysis can make the nails susceptible to fungal infection. Red or black nails due to a hematoma, or blood under the nail, usually occur from trauma (like whacking yourself on the thumb with a hammer). The discolored area will grow out with the nail and be trimmed off as you trim your nails. If you have a black spot under your nail that was not caused by trauma, you may want to see a dermatologist or a podiatrist if it involves a toenail to make sure it is not melanoma (a type of skin cancer associated with pigmented cells). A simple biopsy can rule out malignancy (cancer). Green nails can be caused by Pseudomonas bacteria, which grow under a nail that has partially separated from the nail bed. This infection may cause a foul odor of the nails. The treatment is to trim the nail short every four weeks, don't clean it, polish if you want to hide the color, and wait two to three months. It is also advised to avoid soaking the nail in any sort of water (even if inside gloves) and to thoroughly dry the nail after bathing. If the problem continues, there are prescription treatments that your doctor may try. Pitted nails may be associated with psoriasis or other skin problems that affect the nail matrix, the area under the skin just behind the nail. This is the area from which the nail grows. Nails affected by psoriasis can also be tan in color. Swelling and redness of the skin around the nail is called paronychia. This is an infection of the skin at the bottom of the nail (cuticle). If the infection is acute (has a rapid onset), it is usually caused by bacteria. It may respond to warm soaks but will often need to be drained by a doctor. A chronic paronychia occurs when a cuticle becomes inflamed or irritated over time. Sometimes, yeast will take advantage of the damaged skin and infect the area as well. Therapy begins with keeping the skin dry and out of water. If the problem continues, a physician should be consulted. Antibiotics are not often used but may be necessary in severe infection. Chronic nail trauma, such as repeatedly starting and stopping, kicking, and other athletic endeavors, can cause damage to the nails that can look a lot like fungal nails. This sort of repetitive trauma can also occur with certain types of employment or wearing tight-fitting shoes. Some traumas may cause permanent changes that may mimic the appearance of fungal nails."
"What causes fungal nails, and what are some of the risk factors?","'In normal, healthy people, ''fungal infections'' of the nails are most commonly caused by fungus that is caught from moist, wet areas. Communal showers, such as those at a gym or ''swimming'' pools, are common sources. Going to nail salons that use inadequate sanitization of instruments (such as clippers, filers, and foot tubs) in addition to living with family members who have fungal nails are also risk factors. Athletes have been proven to be more susceptible to ''nail fungus''. This is presumed to be due to the wearing of tight-fitting, sweaty shoes associated with repetitive trauma to the toenails. Having '""athlete's foot""' makes it more likely that the fungus will infect your toenails. Repetitive trauma also weakens the nail, which makes the nail more susceptible to fungal infection.''Elderly people and people with certain underlying disease states are also at higher risk. Anything that impairs your immune system can make you prone to getting infected with the fungus. These include conditions such as ''AIDS'', ''diabetes'', ''cancer'', ''psoriasis'', or taking any immunosuppressive medications like steroids.' "
