Questions,Answer
How Do Sexual Problems Affect Women?,"'The most common problems related to sexual dysfunction in women include:' Inhibited sexual desire: This involves a lack of sexual desire or interest in sex. Many factors can contribute to a lack of desire, including hormonal changes, medical conditions and treatments (for example cancer and chemotherapy), depression, pregnancy, stress, and fatigue. Boredom with regular sexual routines also may contribute to a lack of enthusiasm for sex, as can lifestyle factors, such as careers and the care of children. 
 Inability to become aroused: 
 For women, the inability to become physically aroused during sexual activity often involves insufficient vaginal lubrication. The inability to become aroused also may be related to anxiety or inadequate stimulation. In addition, researchers are investigating how blood flow problems affecting the vagina and clitoris may contribute to arousal problems. Lack of orgasm (anorgasmia): 
  This is the absence of sexual climax (orgasm). It can be caused by sexual inhibition, inexperience, lack of knowledge, and psychological factors such as guilt, anxiety, or a past sexual trauma or abuse. Other factors contributing to anorgasmia include insufficient stimulation, certain medications, and chronic diseases. 
   Painful intercourse: Pain during intercourse can be caused by a number of problems, including endometriosis, a pelvic mass, ovarian cysts, vaginitis, poor lubrication, the presence of 
scar tissue from surgery or a 
sexually transmitted disease. A condition called vaginismus is a painful, involuntary spasm of the muscles that surround the vaginal entrance. It may occur in women who fear that penetration will be painful and also may stem from a sexual phobia or from a previous traumatic or painful experience. 
"
How Is a Female Sexual Problem Diagnosed?,"""To diagnose a woman's sexual problem, the doctor likely will begin with a thorough evaluation of symptoms and a physical exam. The doctor may perform a ""'pelvic exam'' to evaluate the health of the reproductive organs and a ''Pap smear'' to detect changes in the cells of the cervix (to check for ''cancer'' or a pre-cancerous condition). He or she may order other tests to rule out any medical problems that may be contributing to the problem.''An evaluation of your attitude regarding sex, as well as other possible contributing factors (fear, ''anxiety'', past sexual trauma/abuse, relationship problems, ''alcohol'' or ''drug abuse'', for example) will help the doctor understand the underlying cause of the problem and make appropriate recommendations for treatment.' "
How Are Female Sexual Problems Treated?,"'The ideal approach to treating sexual problems in women involves a team effort between the woman, doctors, and trained therapists. Most types of sexual problems can be corrected by treating the underlying physical or psychological problems. Other treatment strategies focus on the following:' Providing education. Education about human anatomy, sexual function, and the normal changes associated with aging, as well as sexual behaviors and responses, may help a woman overcome her anxieties about sexual function and performance. Enhancing stimulation. This may include the use of erotic materials (videos or books), masturbation, and changes to sexual routines. 
   Providing distraction techniques. Erotic or non-erotic fantasies, exercises with intercourse, music, videos, or television can be used to increase relaxation and eliminate anxiety. 
   Encouraging non-coital behaviors. Non-coital behaviors (physically stimulating activity that does not include intercourse), such as sensual massage, can be used to promote comfort and increase communication between partners. 
   Minimizing pain. Using sexual positions that allow the woman to control the depth of penetration may help relieve some pain. The use of vaginal lubricants can help reduce pain caused by friction, and a warm bath before intercourse can help increase relaxation. 
"
Can Female Sexual Problems Be Cured?,"'The success of treatment for female sexual dysfunction depends on the underlying cause of the problem. The outlook is good for sexual problems related to a treatable or reversible physical condition. Mild dysfunction that is related to stress, fear, or anxiety often can be successfully treated with counseling, education, and improved communication between partners.' "
How Do Hormones Affect Sexual Function?,"'Hormones play an important role in regulating sexual function in women. With the decrease in the female hormone estrogen that is related to aging and ''menopause'', many women experience some changes in sexual function as they age, including poor vaginal lubrication and decreased genital sensation. Further, research suggests that low levels of the male hormone testosterone also contribute to a decline in sexual arousal, genital sensation, and orgasm. Researchers still are investigating the benefits of hormones and other medications, including drugs like ''Viagra'', to treat sexual problems in women.' "
What Effect Does a Hysterectomy Have on Sexual Function?,"'Many women experience changes in sexual function after a ''hysterectomy'' (surgical removal of the uterus). These changes may include a loss of desire as well as decreased vaginal lubrication and genital sensation. These problems may be associated with the hormonal changes that occur with the loss of the uterus. Furthermore, nerves and blood vessels critical to sexual function can be damaged during the surgery.' "
How Does Menopause Affect a Woman's Sexual Function?,"'The loss of estrogen following ''menopause'"" can lead to changes in a woman's sexual functioning. Emotional changes that often accompany menopause can add to a woman's loss of interest in sex and/or ability to become aroused. ""'Hormone replacement therapy'' -- ''HRT'' -- may improve certain conditions, such as loss of vaginal lubrication and genital sensation, which can create problems with sexual function.''It should be noted that some ''postmenopausal'' women report an increase in sexual satisfaction. This may be due to decreased anxiety over getting ''pregnant''. In addition, postmenopausal woman often have fewer child-rearing responsibilities, allowing them to relax and enjoy intimacy with their partners.' "
"When Should I Call My Doctor About Sexual 
Problems?","'Many women experience a problem with sexual function from time to time. However, when the problems are persistent, they can cause distress for the women and her partner, and can have a negative impact on their relationship. If you consistently experience these problems, see your doctor for evaluation and treatment.''WebMD Medical Reference' "
What are sexual problems in men?,"'Sexual health'"" is an important part of a man's life, no matter his age, civil status, or sexual orientation. It is also an important part of a couple's foundation and contributes to the quality of life. Sexual problems in men are very common and impact sexual health. Many problems with sexual health can be treated. Therefore, it is important for a man to discuss these issues with a physician.""""The definition of sexual dysfunction is the inability to have a satisfactory sexual relationship. This definition depends on each person's own interpretation on what he judges satisfactory. In general, sexual dysfunction can affect the quality of life and, even more importantly, can be the first symptom of another medical or psychological problem. Any sexual complaint should be taken seriously and evaluated."" "
How does sexual function work?,"'Sexual activity involves coordination between various systems of the body. Hormones and neurological pathways must be in sync for sexual desire to be present. Blood vessels, nerves, and penile integrity must all be present for an adequate erection and its maintenance during the sexual relation. Muscles and nerves coordinate ejaculation achieved when the physiological passageway for sperm (from the testicles to the urethra) is present. ''Orgasm'"" is a complex phenomenon that isn't completely understood, but it involves the coordination of muscles and nerves. When sexual dysfunction is present, the physician must evaluate all the possible problems in this chain of events."" "
What are the types of sexual dysfunction in men?,"'Types of sexual dysfunction include disorders involving sexual desire or libido, erection, ejaculation, and orgasm. They will be described separately, but understand that some medical conditions can affect two or more disorders at the same time.'  "
How are sexual problems in men diagnosed?,"""Evaluation of sexual dysfunction starts with a detailed medical, sexual, and psychological history, followed by a thorough physical examination. The second step must not be overlooked because sexual dysfunction can have many causes. Sometimes, the patient's partner can also contribute to the evaluation and could provide useful information as well.""'A detailed medical, psychological, and sexual history is acquired during the interview with the physician. Some of the questions that are asked can be intimate and might cause you to feel too shy to answer thoroughly. It is imperative to give the proper information, even though it is understandable that it can take time to be comfortable talking about this. Having a good relationship with your physician is always helpful.''Some of the questions the doctor could ask might concern the frequency of sexual relations, your sexual orientation, if the frequency or quality of sexual relations are satisfying, and your number of sexual partners, among others. They will also inquire about nonsexual-related complaints.''A complete physical examination is performed including assessing the pulses in the legs and a thorough examination of the external genitalia (penis, scrotum, and perineum) and their reflexes.''One of the possible tests is a ''nocturnal'' tumescence test to evaluate nocturnal erections. Your physician might also ask for tests for penile blood vessel function or some tests of the nervous system to help differentiate between possible causes of sexual dysfunction.' "
What is the treatment for sexual problems in men?,"'The treatment plan depends greatly on the precise cause of the sexual problem. If the cause is psychological, help from a psychiatrist or psychologist can be helpful. Often in this situation, ''cognitive behavioral therapy'' is the treatment used. Sometimes the treatment will include couples therapy. If the cause of the diminished libido is from medications being taken, sometimes there are alternative medications without sexual side effects. For others, hormonal replacement may be suggested. Talk to your doctor about any changes in libido you have experienced.'  "
What is low libido (low sexual desire)?,"'The definition of ''low libido'"" is when sexual desire is diminished or absent. The definition also varies according to the patient's level of satisfaction of his own sexual desire. Some men can be very fulfilled with what some men consider scarce sexual activity.""'Sexual desire problems affect a small percentage of men in the general population. Libido is mainly a hormonal and brain phenomenon. Sexual desire requires normal levels of testosterone (male hormone) in the blood and a certain attraction for the partner in question.' "
What are the symptoms of low libido?,"""The person that lacks sexual desire won't want to initiate the sexual relation. If the act is initiated, ""'low libido'' can also present itself as the inability to attain an erection. If the patient experiences a first episode of ''erectile dysfunction'' without any previous sexual symptoms and adequate nocturnal erection, the cause is probably psychogenic and the problem is not the erection. It is also important to specify if the low libido is new in onset or if one has always felt this way about sexual relations.' "
What causes a low sex drive in men?,"'Many causes have been identified as contributing to the diminishment of sexual desire. They include:' Medications (SSRIs, anti-androgens, 5-alpha-reductase inhibitors, opioid analgesics) Alcoholism Depression Fatigue Hypoactive sexual disorder Recreational drugs Relationship problems Other sexual dysfunction (fear of humiliation) Sexual aversion disorder Systemic illness Testosterone deficiency Stress Lack of time History of sexual abuse Hormonal problems such as hyperthyroidism"
What are risk factors for low libido?,"'Risk factors for low libido in men include:' Age because testosterone concentration will decrease over the years Alcohol consumption Malnourishment Smoking Drug consumption Conditions requiring medication that lowers testosterone, depression, benign prostatic hyperplasia (BPH), pain, and prostate cancer"
What is erectile dysfunction (impotence)? Who gets it?,"'Erectile dysfunction'' (''ED'') is the inability to acquire or maintain a satisfactory erection. The prevalence of ''erectile dysfunction'"" varies according to the patient's age. About 16% of men from 50 to 59 years of age will suffer from erectile dysfunction and 44% of those aged 70 to 75 years will, too.""'There are three types of erections -- those caused by tactile stimulation, those caused by mental stimulation, and those that men experience while sleeping. This classification can be important when the cause of erectile dysfunction is yet to be determined.''In order to have an erection, men need stimuli; they need blood arriving from the arteries and have veins capable of locking the blood in place. Each of the numerous steps in this system can fail making erectile dysfunction a complex problem for investigation.' "
What are the symptoms of erectile dysfunction?,"'Erectile dysfunction will cause the penis to be unable to acquire or maintain a satisfactory erection. It is important to specify to the doctor the rapidity of onset, the presence of nocturnal erections, and the quality of the erection if it can be attained but not maintained. The quality of an erection can be judged according to the rigidity and the functionality (Is the penis erect enough to allow for vaginal penetration?).''Erectile dysfunction with sudden onset and no previous history of sexual dysfunction suggests a psychogenic cause, unless there was a previous surgery or a genital ''trauma''. The loss of nocturnal erections will suggest a neurologic or vascular cause. Finally, when an erection is not sustained, its loss may be due to an underlying psychological cause or vascular problem. Talk to your doctor if you have noticed any problems with your erectile function.' "
What causes erectile dysfunction?,"'There are numerous potential causes of erectile dysfunction.''Neurologic causes include:''Vascular causes include:''Hormonal causes include:''Pharmacological causes include:''Penile dysfunction causes include:''Psychiatric causes include:''Functional causes include:' Stroke Spinal cord or back injury Multiple sclerosis Dementia Pelvic trauma Prostate surgery (even with nerve-sparing surgeries it can take up to 24 months to regain normal sexual function) Priapism Nervous system tumor Epilepsy Diabetic neuropathy Arteriovenous fistula Diabetes Atherosclerosis Congenital anomaly Low testosterone blood level (The patient can achieve an erection but it won't always be turgid enough for vaginal penetration.) Hyperprolactinemia Hyperthyroidism Hypothyroidism Cushing's disease Addison's disease Antidepressants (mainly SSRIs) Spironolactone Sympathetic blockers (clonidine, guanethidine, or methyldopa) Thiazide diuretics Ketoconazole Cimetidine Peyronie's disease Loss of feeling toward the other person Stress Fear of non-performance Bicycling irritating the nerves and tissue of the penis"
What are the risk factors for erectile dysfunction?,'The risk factors for erectile dysfunction include:' Obesity Smoking Diabetes High blood pressure High cholesterol Cardiovascular disease Medication use Obstructive sleep apnea Restless leg syndrome Systemic sclerosis (scleroderma) Peyronie's disease Prostate cancer treatment
What is the treatment for erectile dysfunction?,"'Nowadays, there are many options for men who suffer from erectile dysfunction. Before suggesting pharmacological help, the doctor may suggest a change in lifestyle habits. Since many causes of erectile dysfunction are disorders in which lifestyle changes will have a positive effect, addressing these issues can be helpful. Therefore, regular ''exercise'', a healthy ''diet'', ''smoking cessation'', and limiting alcohol consumption can all have an impact on erectile function. Lifestyle changes can also include the use of a more genitalia-friendly bicycle seat.' "
What are nonsurgical treatments for erectile dysfunction?,"'There are many nonsurgical treatments available for erectile dysfunction.''Oral pharmacological treatment''The first line of pharmacological treatment is a class of medication called phosphodiesterase (PDE-5) inhibitors. This class includes ''sildenafil'' (''Viagra''), ''vardenafil'' (''Levitra''), and ''tadalafil'' (''Cialis''). They will improve the ability to attain and maintain the erection, but sexual stimulation is still required for this medication to work. It should be taken some time before the sexual act is planned, but has a long timeframe of action. Side effects include visual disturbances, flushing, ''back pain'', and ''muscle pain''. Most side effects will abate with time. Usually, there will be no side effects at all. If you are taking ''nitrates'', phosphodiesterase inhibitors are not recommended since both medications taken simultaneously could cause severe ''hypotension'' (excessive ''low blood pressure'').'""Other types of oral medication are available. Apomorphine will enhance penile erection. And there are others. You should ask your doctor for other types of medication if the first one didn't work. Other treatment options should also be discussed.""'Transurethral therapy''Another type of pharmacological solution is a liquid that can be applied in the urethra that manages to improve erection. The erection can be maintained by applying an elastic band at the base of the penis.''Intracavernous injection''Injections at the base of the penis (intracavernous) can help attain and maintain an erection. There are various types of solutions that can be injected -- ''papaverine'"", alprostadil, and drug combinations. These injections are considered the most effective treatments for erectile dysfunction. They are also convenient for the patients who don't tolerate the oral therapies.""'Side effects include priapism (prolonged and painful erection) and fibrosis (scarring) but they are rare. There are ways to prevent these side effects (especially the prolonged and painful erection). The patient must follow the training and recommendations given at the beginning of this type of therapy. Contraindications for intracavernous injections include ''sickle cell anemia'', ''schizophrenia'', and severe psychiatric disorder.''Vacuum constriction device''This is a ''plastic'' cylinder connected to a vacuum-generating source that creates a negative pressure that draws the blood to the penis and makes way for an erection. An elastic band must be placed at the base of the penis to maintain the rigidity. The base of the penis will stay flaccid which might make the genitalia pivot. Side effects include ejaculatory problems, ''penile pain'', and blood pooling because of ruptured blood vessels (ecchymosis or ''petechiae'').' "
What are surgical treatments for erectile dysfunction?,"'There are numerous surgical treatments available for erectile dysfunction.''Penile vascular surgery'""Bypass surgery can be performed when there is an isolated artery occlusion disrupting blood flow in the penis. With any surgical procedure, it's necessary to consider the patient's surgical risk. Not all patients will be able to qualify for this type of intervention.""'Prosthesis''Various types of prosthesis are available -- malleable, mechanical, and inflatable. The patient should discuss the type he would prefer with his physician. The majority of prostheses will need replacement after 10 to 15 years. Surgical complications include infection, mechanical failure, cylinder leaks, perforation, penile shortening, autoinflation, and ''pain''.' "
What is premature ejaculation?,"'Premature ejaculation is the most common of the ejaculatory disorders; approximately 20% to 30% of men will have premature ejaculation. Ejaculation problems involve the improper discharge of sperm, prostatic, and seminal vesicle fluid through the urethra.''There are three different types of premature ejaculation:' Premature ejaculation is ejaculation after minimal or no physical stimulation. Retarded ejaculation is ejaculation after a long delay of physical stimulation. Retrograde ejaculation is orgasm without ejaculation, also called ""dry"" ejaculation."
What are the symptoms of premature ejaculation?,"'Classically, premature ejaculation includes:''Generally, premature ejaculators will only have about a minute or less of intravaginal time before they ejaculate.''Retarded ejaculation will present as a long delay of intravaginal time to the point where the patient will not be satisfied with the sexual relation.'""Anejaculation or retrograde ejaculation is the experience of a dry orgasm. The semen doesn't go out of the urethra. It can either flow to the bladder instead or not be produced at all. Following the sexual act in the latter case, patients will notice the presence of semen in their first urine."" Brief ejaculatory latency Loss of control Psychological distress in the patient and/or partner"
What causes premature ejaculation?,"'There are many potential causes of premature ejaculation. These include neurological causes that affect the following areas:''Premature ejaculation may be caused by negative conditioning and penile hypersensitivity. Retarded ejaculation may be an early sign of ''diabetes'' or may develop following surgery for ''benign prostatic hyperplasia'' (''BPH''). Anejaculation (retrograde ejaculation) may be caused by radical ''prostatectomy'', cystoprostatectomy (removal of the bladder and the rectum), or the use of certain medications such as alpha-blockers (''tamsulosin'') and antidepressants (SSRIs).' Central control of ejaculation Innervations to the seminal tract Sensory innervation to the genitalia/prostate"
What is the treatment for premature ejaculation?,"'The treatment will vary according to the cause of premature ejaculation. Couples sexual therapy or psychological therapy can be useful when psychological causes are involved. Other nonpharmacological therapies include actively trying to ""hold it in."" Drug therapy has also proven to be successful. The medications used to treat premature ejaculation are selective serotonin reuptake inhibitors (SSRIs) and ''tricyclic antidepressants'' (TCAs).' "
What is disordered orgasm?,'Disordered orgasm is the inability to reach an orgasm after adequate stimulation. Orgasm is still a phenomenon that is poorly understood.' 
What causes disordered orgasm?,"'The causes of disordered orgasm include:' Psychiatric disorder Diabetic neuropathy Multiple sclerosis Complications from genital surgery Pelvic trauma Drugs (alpha-blockers, antidepressants)"
What is the treatment for disordered orgasm?,'Anorgasmia will be treated with psychiatric help or by treating the underlying cause.' 
What are other kinds of sexual dysfunction in men?,"""Another category of sexual problem is sexual pain. A penile lesion, injury, or a skin disease can be the cause among others. Men's sexual pain occurs less frequently than women's."" "
At what age do men experience sexual dysfunction?,"'There are normal changes in sexual function in the elderly. Older men can have the following symptoms of sexual dysfunction:''These phenomena can be experienced as patients grow old. Nevertheless, it can be addressed so that those affected can still have a very satisfactory sexual life.' Longer delay between stimulation and erection Erection is less turgid Ejaculation is less strong Ejaculatory volume is smaller Time between erections is longer Less sensitivity to tactile stimuli Lower testosterone Orgasm is attained more slowly"
Can sexual problems in men be prevented?,"'Lifestyle changes can be useful to help treat or improve sexual dysfunction, but more importantly, they can have an impact before the development of the disease itself. You can prevent the incidence of sexual troubles by having a healthy lifestyle; ''exercise'' regularly, eat well, limit alcohol consumption, and ''quit smoking'', if you are a smoker. Lifestyle changes take time and effort, but the results are worthwhile.' "
What is the prognosis for sexual problems in men? Can they be cured?,"'Prognosis varies according to the method of treatment and the underlying disease. Nowadays, many innovations have changed the face of male sexual dysfunction giving men multiple options regarding treatment. Not only do men have choices but the developing technologies and medications have also given men a voice to share their experience.'""It's very important that you speak to your doctor about any concern regarding your sexual function or that of your partner."" "
Which types of doctors or specialists treat sexual problems in men?,"'Psychiatrists, psychologists, and sexologists can be involved in the management of sexual dysfunction. Psychiatrists or psychologists can especially help when the cause of the dysfunction is psychogenic. Therapies targeting cognition and behavior usually have good success rates. Sexologists can also contribute to these therapies.' "
