Questions,Answer
What is the treatment for a Zika virus infection?,"'There is no specific medicine that can treat the viral infection; the treatment is aimed at reducing the symptoms of the disease. Oral and/or IV hydration helps reduce symptoms and dehydration. The CDC has published highly detailed guidelines about Zika infections and treatment. However, they are too detailed (for example, see references 2 [6 pages] and 3 [90 slides]) to present in this article. In addition, the CDC is likely to modify these guidelines as data emerge from new studies of this virus. Pregnant women, in addition to receiving the symptomatic treatment described above, need to discuss assessments and treatments in detail with their ''OB/GYN'' doctor; each pregnant patient may need individualized treatment during pregnancy. The CDC provides an up-to-date podcast for pregnant women concerning Zika virus (''http://www2c.cdc.gov/podcasts/player.asp?f=8642324'').' "
What specialists treat Zika infections?,"'Many infected people do not require treatment or can be treated by their primary-care doctor, including family medicine specialists or internists. With complications, ''OB''/GYN doctors, maternal/fetal specialists, pediatric intensive-care specialists, and neurologists may be involved with the patient. In addition, infectious-disease specialists and travel-medicine specialists may be consulted about Zika infections.' "
What are the complications of Zika virus infections?,"'Although complications of the virus infection are rare, some can be life-threatening, such as severe dehydration. Neurological changes can occur; for example, ''Guillain-Barré syndrome''. In addition, a large increase in ''congenital malformations'"" (mainly microcephaly) and other developmental issues have been associated with these viral infections in Brazil and is currently under study. New studies suggests that eye abnormalities in microcephalic babies are linked to the virus infection (see the following section). In addition, the infection may be the cause of another brain problem, acute disseminated encephalomyelitis (ADEM), in which the brain cells' protective sheaths of myelin are disrupted, leading to symptoms like those of ""'multiple sclerosis'' (''MS'').' "
What are the risks of contracting a Zika virus infection during pregnancy?,"'The risk to the mother of contracting a Zika virus infection during pregnancy is the same risk for individuals who are not pregnant, but the risk to the fetus to develop an abnormality such as microcephaly (small head and small brain) seems to be elevated in pregnancy, especially in Brazil. The epidemiological data and new research findings in Brazil suggest a likely association between congenital microcephaly and Zika infection of pregnant women. Zika virus infections first arose in Brazil in May 2015. Pregnant women, especially those in the first and early ''second trimester'"", in areas where the disease is prevalent should try to avoid any mosquito bites. Officials in Brazil are concerned since almost 4,000 babies (very unusually high number as compared to similar time periods in which only about 150 babies were diagnosed with microcephaly) have been born with microcephaly since May 2015. In addition, Dr. R. Coeli, a pediatrician in Brazil, has reported Zika viruses isolated from the amniotic fluid of two women and one infant's brain and heart tissue -- results she concludes that tie the Zika virus to microcephaly development. Officials have taken the unusual step to recommend women avoid pregnancy until the cause of the increase in microcephaly is definitively determined. Several agencies are intensively studying this problem, and a new study has data that researchers state definitively proves that Zika virus causes microcephaly (see reference 3).""""In addition, a new study of infants with microcephaly and presumed Zika virus congenital infection demonstrated that 10 of 29 infants studied (34.5%) had developed a range of vision defects from minor to vision-threatening lesions (focal pigment mottling, chorioretinal atrophy, and/or optic disc abnormalities). The researchers indicate there is no definitive link yet to the eye abnormalities and the virus infection, but if other diseases are ruled out, the investigators suggest Zika virus may be is linked to the development of these vision abnormalities. In a similar small study in Brazil, two people with Zika infection developed acute disseminated encephalomyelitis (ADEM) with brain cell damage to their brain's white matter."" "
What is the prognosis of a Zika virus infection?,"'For the large majority of patients who get the viral infection, the prognosis is excellent with few or no complications developing. However, depending upon the association between the infection and congenital microcephaly, eye abnormalities and Guillain-Barré syndrome being a cause-and-effect situation, the outcome of microcephaly is poor. Patients with ADEM may recover in about six months.' "
Is it possible to prevent a Zika virus infection?,"'Yes, it is possible to prevent Zika virus infections; this may be done by preventing any mosquito bites as the mosquitoes are the vector for the viral disease. In fact, some governments like those in Jamaica are encouraging residents to prevent infections by avoiding areas where mosquitoes breed, destroying areas where mosquitoes breed (for example, getting rid of old tires that contain water), wearing clothing that covers most of the skin areas of the body (long-sleeved shirts and pants), and by using mosquito repellents, such as DEET, oil of lemon eucalyptus, para-methane-diol, or permethrin (all are EPA-registered insect repellents).''Unfortunately, the two ''Aedes'' species of mosquitoes feed during the day, not only at dusk and at dawn; this increases the chances of a person getting a mosquito bite. Consequently, staying inside, removing standing water around the home, use of appropriate insect repellent, mosquito bed nets, and public-service spraying can help prevent Zika virus infections.''In addition, the CDC has recommendations for travel areas to avoid where Zika virus is present in the mosquito population (see CDC travel recommendations below).' "
Is there a vaccine against Zika virus?,"'Currently, there is no vaccine to prevent Zika virus infections. The U.S. president and health officials are requesting emergency funding ($1.9 billion) to combat the Zika virus in the U.S. to help protect pregnant women and their fetuses from the disease, to develop a vaccine and to reduce or eliminate Zika virus infections transmitted by mosquitoes. CDC officials are concerned that the problems such as neurological changes and microcephaly may be underestimated and the situation is ""scarier than we initially thought,"" according to Dr. Anne Schuchat, deputy director at the CDC.' "
"CDC advisory on travel to areas with Zika virus, 
including the U.S. (Florida)","'On Jan. 15, 2016, the CDC issued a travel alert concerning Zika virus. The CDC recommended that pregnant women avoid traveling to areas with Zika outbreaks, and women thinking about ''becoming pregnant'' need to consult with their doctors before traveling to areas with Zika virus outbreaks. Women who must travel to areas with Zika virus outbreaks should consult with their doctors about pregnancy risks and take precautions to avoid any mosquito bites. The CDC is continually updating the world map of the locations where Zika virus outbreaks have and are occurring (''http://www.cdc.gov/zika/geo/''). Some athletes have chosen to skip the Olympic Games scheduled in Brazil in 2016 because of the widespread Zika outbreak in the country.''In addition, the CDC has updated recommendations for travel areas to avoid where Zika virus is present in the mosquito population so there is active transmission of the disease. This large list of countries can be found at the following site, ''http://www.cdc.gov/zika/geo/active-countries.html'', and now includes a neighborhood named Wynwood, in Miami, Florida. About 17 individuals have been infected with the virus by mosquito bites in this area. Public-health officials are actively trying to reduce or eliminate mosquito populations in Wynwood. However, CDC officials project there will be other neighborhoods or regions in the U.S. where mosquito populations will likely become infested with the virus and become vectors for the disease.' "
